title,location,property_type,price,price_per_bedroom,bedrooms,bathrooms,price_category,added_date,updated_date,month_added,state
Land,arowojeka circular road ibadan north east oyo,land,10000000,0,0,0,Mid,30/09/2025,18/02/2026,2025-09,Oyo
1279sqm Of Land,"apampa road, jericho ibadan oyo",land,200000000,0,0,0,High,15/09/2025,18/02/2026,2025-09,Oyo
Newly Built 5 Bedroom Duplex,engr. lere adigun gra akobo ibadan oyo,duplex,220000000,0,0,0,High,16/09/2025,18/02/2026,2025-09,Oyo
1 Acre And 2 Plots Of Industrial Land,old lagos road podo ibadan oyo,land,300000000,0,0,0,High,26/09/2025,18/02/2026,2025-09,Lagos
7 Bedroom Duplex,alalubosa gra alalubosa ibadan oyo,duplex,300000000,0,0,0,High,16/09/2025,18/02/2026,2025-09,Oyo
14500sqm Land,new bodija ibadan oyo,land,2500000000,0,0,0,High,15/09/2025,18/02/2026,2025-09,Oyo
An Uncompleted Gated 3 Bedroom Bungalow,"nihort area, jericho extension, idishin ibadan oyo",Bungalow,45000000,0,0,0,Mid,13/10/2025,18/02/2026,2025-10,Oyo
Nicely Built 4 Units Of 3 Bedroom Flat,"ologuneru, eleyele ibadan oyo",Flat/Apartment,70000000,0,0,0,High,13/10/2025,18/02/2026,2025-10,Oyo
Newly Built 4 Bedroom Flat,carlton gate akobo ibadan oyo,Flat/Apartment,250000000,0,0,0,High,30/09/2025,18/02/2026,2025-09,Oyo
4 Bedroom And 2 Bedroom Duplex,ashi bodija ibadan oyo,duplex,160000000,0,0,0,High,30/09/2025,18/02/2026,2025-09,Oyo
1934sqm Commercial Land,"along awolowo road, bodija ibadan oyo",Commercial land,700000000,0,0,0,High,14/10/2025,18/02/2026,2025-10,Oyo
Sophisticated 3 Bedroom Bungalow With Modern Fittings,"ateere, kasunmu road, akala express ibadan oyo",Bungalow,90000000,0,0,0,High,13/10/2025,18/02/2026,2025-10,Oyo
Acre Of Industrial Land,"old lagos road, oluyole lga podo ibadan oyo",land,210000000,0,0,0,High,26/09/2025,18/02/2026,2025-09,Lagos
Plot Of Residential Land,new bodija bodija ibadan oyo,land,150000000,0,0,0,High,02/10/2025,18/02/2026,2025-10,Oyo
3 Acres Of Land,after fresh fm challenge ibadan oyo,land,35000000,0,0,0,Mid,26/09/2025,18/02/2026,2025-09,Oyo
Newly Built 5 Bedroom Duplex,"alpha grace, nihort jericho ibadan oyo",duplex,250000000,0,0,0,High,22/09/2025,18/02/2026,2025-09,Oyo
3600sqm Warehouse,oluyole industrial estate oluyole estate ibadan oyo,warehouse,1500000000,0,0,0,High,24/09/2025,18/02/2026,2025-09,Oyo
Uncomplted Twin 3 Bedroom Bungalow,odo ona kekere ibadan oyo,Bungalow,17000000,0,0,0,Mid,09/09/2025,18/02/2026,2025-09,Oyo
10 Bay Warehouse,"ikeja industrial estate, ikeja lagos",warehouse,5000000000,0,0,0,High,15/09/2025,18/02/2026,2025-09,Lagos
3700sqm Land,samonda ibadan oyo,land,950000000,0,0,0,High,15/09/2025,18/02/2026,2025-09,Oyo
4 Bedroom Bungalow,"oleyo road, akala express ibadan oyo",Bungalow,12000000,0,0,0,Mid,08/10/2025,18/02/2026,2025-10,Oyo
Residential Environment,mowe obafemi owode ogun,maisonette,5500000,0,0,0,Low,02/10/2025,18/02/2026,2025-10,Ogun
Modernly Built Hostel Of Many Units,apete olomo apete ibadan oyo,Flat/Apartment,48000000,0,0,0,Mid,02/10/2025,18/02/2026,2025-10,Oyo
3 Bedroom Bungalow,owode apata ibadan oyo,Bungalow,35000000,0,0,0,Mid,13/10/2025,18/02/2026,2025-10,Oyo
2 Bedroom Flat,jankata akala express ibadan oyo,Flat/Apartment,65000000,0,0,0,High,22/09/2025,18/02/2026,2025-09,Oyo
Uncompleted 4 Bedroom Semi Detached Duplex,"white gate, oluyole estate ibadan oyo",Detached,150000000,0,0,0,High,15/09/2025,18/02/2026,2025-09,Oyo
1449sqm Land,"alafaara, ile tuntun, idishin ibadan oyo",land,15000000,0,0,0,Mid,13/10/2025,18/02/2026,2025-10,Oyo
3 Bedroom Paint House Apartment,lekki phase 1 lekki lagos,Flat/Apartment,340000000,113333333,3,3,High,04/02/2026,18/02/2026,2026-02,Lagos
5 Bedroom Fully Detached Duplex,chevron toll gate lekki lagos,Detached,520000000,104000000,5,5,High,26/01/2026,18/02/2026,2026-01,Lagos
5 Bedroom Fully Detached Duplex,ikota lekki lagos,Detached,410000000,82000000,5,5,High,27/01/2026,18/02/2026,2026-01,Lagos
5 Bedroom Ensuite,ikota lekki lagos,5 bedroom,460000000,92000000,5,5,High,27/01/2026,18/02/2026,2026-01,Lagos
5 Bedroom Fully Detached Duplex With Bq,chevron toll gate lekki lagos,Detached,450000000,90000000,5,5,High,28/01/2026,18/02/2026,2026-01,Lagos
1 Bedroom Apartment,oniru victoria island lagos,Flat/Apartment,190000000,95000000,2,2,High,14/01/2026,18/02/2026,2026-01,Lagos
5 Bed Fully Detached Duplex,lekki phase 1 lekki lagos,Detached,1000000000,200000000,5,5,High,04/02/2026,18/02/2026,2026-02,Lagos
700sqm Estate Plot At Nnpc By Ochacho Life Camp,life camp life camp abuja,land,110000000,27500000,4,4,High,04/02/2026,18/02/2026,2026-02,Abuja
17 Bedroom Mansion,maitama main maitama abuja,mansion,5.50E+12,5.50E+11,10,10,High,04/11/2025,18/02/2026,2025-11,Abuja
Newly Built And Spacious 3 Bedroom Apartment,news engineering dawaki dawaki abuja,Flat/Apartment,125000000,41666667,3,3,High,22/11/2025,18/02/2026,2025-11,Abuja
Luxurious 5 Bedroom Duplex With Bq,"efab estate karsana district, karsana abuja",duplex,750000000,150000000,5,5,High,19/10/2025,18/02/2026,2025-10,Abuja
Land,"life camp in nnpc estate, life camp abuja",land,85000000,0,0,0,High,24/10/2025,18/02/2026,2025-10,Abuja
Land,jahi by aduve international school jahi abuja,land,750000000,0,0,0,High,07/12/2025,18/02/2026,2025-12,Abuja
Commercial Land,jabi jabi abuja,Commercial land,1.80E+12,0,0,0,High,22/10/2025,18/02/2026,2025-10,Abuja
Newly Built 6 Bedroom Detached Duplex With Bq,kado kado abuja,Detached,1000000000,166666667,6,6,High,21/10/2025,18/02/2026,2025-10,Abuja
Exquisite And Luxurious 6bedroom With Bq,katampe ext diplomatic zone katampe extension katampe abuja,maisonette,750000000,125000000,6,6,High,09/02/2026,18/02/2026,2026-02,Abuja
Distress Sale Of 8 Units Of 2 Bedroom Apartment,gwarinpa abuja,Flat/Apartment,650000000,325000000,2,2,High,15/12/2025,18/02/2026,2025-12,Abuja
A Flat Land,69road gwarinpa abuja,Flat/Apartment,450000000,0,0,0,High,16/01/2026,18/02/2026,2026-01,Abuja
A Beautiful And Spacious 5bedroom With Bq,karsana efab metropolis karsana abuja,5 bedroom,550000000,110000000,5,5,High,08/02/2026,18/02/2026,2026-02,Abuja
8 Bedroom Automated Detached With Bq,wuse 2 abuja,Detached,3000000000,375000000,8,8,High,21/10/2025,18/02/2026,2025-10,Abuja
Beautiful 4 Bedroom Bungalow With Bq,life camp abuja,Bungalow,270000000,67500000,4,4,High,28/11/2025,18/02/2026,2025-11,Abuja
6 Units Of 3 Bedroom Flat,"main wuye, wuye abuja",Flat/Apartment,1300000000,433333333,3,3,High,15/12/2025,18/02/2026,2025-12,Abuja
Newly Built 4 Bedroom Terraced Duplex With Bq,gwarimpa 6avenue gwarinpa abuja,Terraced,200000000,50000000,4,4,High,24/10/2025,18/02/2026,2025-10,Abuja
3 Bedroom Detached Bungalow With 1 Bq,in an estate life camp abuja,Detached,135000000,45000000,3,3,High,16/10/2025,18/02/2026,2025-10,Abuja
Plot Of Land,guzape abuja,land,2500000000,0,0,0,High,04/02/2026,18/02/2026,2026-02,Abuja
5 Bedroom Detached Duplex With Bq,apo resettlement apo abuja,Detached,320000000,64000000,5,5,High,04/02/2026,18/02/2026,2026-02,Abuja
3 Bedroom Apartment,katampe abuja,Flat/Apartment,190000000,63333333,3,3,High,04/02/2026,18/02/2026,2026-02,Abuja
Plot Of Land,maitama abuja,land,25000000000,0,0,0,High,02/02/2026,18/02/2026,2026-02,Abuja
3 Bedroom Terrace Duplex With Bq,lokogoma abuja,Terraced,105000000,35000000,3,3,High,02/02/2026,18/02/2026,2026-02,Abuja
Plot Of Land,wuye abuja,land,8000000000,0,0,0,High,04/02/2026,18/02/2026,2026-02,Abuja
4 Bedroom Terrace Duplex With Bq,jahi abuja,Terraced,250000000,62500000,4,4,High,04/02/2026,18/02/2026,2026-02,Abuja
"1,018sqm Land","engr seyi makinde estate , ikolaba ibadan oyo",land,150000000,0,0,0,High,31/07/2025,18/02/2026,2025-07,Oyo
5 Bedroom Duplex,"engr lere adigun gra, basorun ibadan oyo",duplex,200000000,40000000,5,5,High,07/09/2025,18/02/2026,2025-09,Oyo
"1,000sqm Of Land",kolapo ishola gra akobo ibadan oyo,land,210000000,0,0,0,High,10/09/2025,18/02/2026,2025-09,Oyo
4 Bedroom Detached Duplex,kolapo ishola gra akobo ibadan oyo,Detached,185000000,46250000,4,4,High,13/07/2025,18/02/2026,2025-07,Oyo
Newly Built 4 Bedroom Duplex,carlton gate estate akobo ibadan oyo,duplex,120000000,30000000,4,4,High,11/07/2025,18/02/2026,2025-07,Oyo
4 Bedroom Duplex,"palm garden estate, green gate ,oluyole oluyole estate ibadan oyo",duplex,185000000,46250000,4,4,High,11/07/2025,18/02/2026,2025-07,Oyo
Newly Built 2 Bedroom Flat,"maicon court, omolayo estate,ibadan akobo ibadan oyo",Flat/Apartment,25000000,12500000,2,2,Mid,04/07/2025,18/02/2026,2025-07,Oyo
Newly Built 4 Bedroom Detached Duplex,"carlton gate estate, akobo ibadan oyo",Detached,170000000,42500000,4,4,High,27/05/2025,18/02/2026,2025-05,Oyo
4 Bedroom Smart Home,"aare oluyole , ibadan oluyole estate ibadan oyo",maisonette,380000000,95000000,4,4,High,01/11/2025,18/02/2026,2025-11,Oyo
4 Bedroom Semi Detached Duplex,"legacy estate, kolapo ishola gra akobo ibadan oyo",Detached,250000000,62500000,4,4,High,05/09/2025,18/02/2026,2025-09,Oyo
4 Bedroom Duplex With Room Bq,"oluyole estate, ibadan oluyole estate ibadan oyo",duplex,300000000,75000000,4,4,High,01/11/2025,18/02/2026,2025-11,Oyo
4 Bedroom Duplex,kolapo ishola g.r.a akobo ibadan oyo,duplex,180000000,45000000,4,4,High,11/03/2025,18/02/2026,2025-03,Oyo
A Room In A Shared Apartment,orchid road lekki lagos,Flat/Apartment,1500000,1500000,1,1,Low,26/01/2026,18/02/2026,2026-01,Lagos
Newly Built Detached 4 Bedroom Duplex,carlton gate estate akobo ibadan oyo,Detached,220000000,55000000,4,4,High,31/05/2025,18/02/2026,2025-05,Oyo
1000sqm Land,lere adigun gra basorun ibadan oyo,land,180000000,0,0,0,High,07/03/2025,18/02/2026,2025-03,Oyo
Newly Built 5 Bedroom Duplex,kolapo ishola gra akobo ibadan oyo,duplex,400000000,80000000,5,5,High,22/05/2025,18/02/2026,2025-05,Oyo
"Land Measuring 1,200sqm",kolapo ishola gra akobo ibadan oyo,land,270000000,0,0,0,High,10/09/2025,18/02/2026,2025-09,Oyo
630 Sqm Land,kolapo ishola gra akobo ibadan oyo,land,145000000,0,0,0,High,25/07/2025,18/02/2026,2025-07,Oyo
Land Measuring 600sqmt,kolapo ishola gra akobo ibadan oyo,land,100000000,0,0,0,High,24/02/2025,18/02/2026,2025-02,Oyo
968sqmt Land,bashorun housing estate akobo ibadan oyo,land,65000000,0,0,0,High,28/02/2025,18/02/2026,2025-02,Oyo
5 Bedroom Duplex,airport abake estate alakia ibadan oyo,duplex,180000000,45000000,4,4,High,01/11/2025,18/02/2026,2025-11,Oyo
5 Bedroom Penthouse,kolapo ishola gra akobo ibadan oyo,penthouse,280000000,56000000,5,5,High,12/07/2025,18/02/2026,2025-07,Oyo
4 Bedroom Duplex,kolapo ishola gra akobo ibadan oyo,duplex,185000000,46250000,4,4,High,11/07/2025,18/02/2026,2025-07,Oyo
5 Bedroom Detached Duplex With Mini Flat Bq,"kolapo ishola gra, akobo ibadan oyo",Detached,360000000,72000000,5,5,High,30/10/2025,18/02/2026,2025-10,Oyo
4 Bedroom Semi Detached Duplex,"chief lateef oyelade, ringroad gra, ring rd ibadan oyo",Detached,145000000,36250000,4,4,High,02/08/2025,18/02/2026,2025-08,Oyo
Land Measuring 1000sqm,"obasa estate,idi ishin, jericho ibadan oyo",land,85000000,0,0,0,High,27/07/2025,18/02/2026,2025-07,Oyo
4 Bedroom Duplex With Penthouse Plus Bq,"chief lateef oyelade gra, oluyole estate ibadan oyo",penthouse,230000000,57500000,4,4,High,02/08/2025,18/02/2026,2025-08,Oyo
Residential Land,"rayfield gardens estate,christopher adebayo alao akala gra ibadan oyo",land,36000000,0,0,0,Mid,20/07/2025,18/02/2026,2025-07,Oyo
5 Bedroom Terrace House With Pent Floor,kolapo ishola gra akobo ibadan oyo,Terraced,200000000,40000000,5,5,High,17/08/2025,18/02/2026,2025-08,Oyo
18 Units Of 2 Bedroom Flat,old bodija ibadan oyo,Flat/Apartment,70000000,35000000,2,2,High,30/10/2025,18/02/2026,2025-10,Oyo
4 Bedroom Detached Duplex,"palace estate , akala, akobo ibadan oyo",Detached,130000000,32500000,4,4,High,30/10/2025,18/02/2026,2025-10,Oyo
Newly Built 2 Bedroom,"ps court ,adenuga ,old bodija bodija ibadan oyo",maisonette,86000000,43000000,2,2,High,04/07/2025,18/02/2026,2025-07,Oyo
515sqmt Of Land,alpha grace jericho gra jericho ibadan oyo,land,40000000,0,0,0,Mid,28/02/2025,18/02/2026,2025-02,Oyo
"2,500sqm Plots Of Land",alalubosa gra phase 1 ibadan oyo,land,420000000,0,0,0,High,23/07/2025,18/02/2026,2025-07,Oyo
4 Bedroom Detached Duplex,"aare oluyole estate, ibadan oyo",Detached,280000000,70000000,4,4,High,26/07/2025,18/02/2026,2025-07,Oyo
Plot Of Land,oloje ologueru eleyele ibadan oyo,land,2000000,0,0,0,Low,24/02/2025,18/02/2026,2025-02,Oyo
5 Bedroom Penthouse,"seye nuga, new bodija ibadan oyo",penthouse,120000000,24000000,5,5,High,16/07/2025,18/02/2026,2025-07,Oyo
4 Bedroom Detached Duplex,alalubosa gra alalubosa ibadan oyo,Detached,250000000,62500000,4,4,High,08/11/2025,18/02/2026,2025-11,Oyo
5 Bedroom Detached Duplex With Penthouse,oluyole estate ibadan oyo,Detached,465000000,93000000,5,5,High,02/11/2025,18/02/2026,2025-11,Oyo
Newly Built 4 Bedroom Detached Duplex,"palace estate,akala akobo ibadan oyo",Detached,100000000,25000000,4,4,High,07/07/2025,18/02/2026,2025-07,Oyo
727 Sqm Corner Piece,kolapo ishola gra akobo ibadan oyo,land,170000000,0,0,0,High,25/07/2025,18/02/2026,2025-07,Oyo
Newly Built 4 Bedroom Detached Duplex,"salami estate, new bodija, ibadan oyo",Detached,275000000,68750000,4,4,High,18/05/2025,18/02/2026,2025-05,Oyo
3 Bedroom Terrace Duplex,"rayfield gardens estate, christopher adebayo alao akala gra ibadan oyo",Terraced,120000000,40000000,3,3,High,20/07/2025,18/02/2026,2025-07,Oyo
5 Bedroom Detached Duplex With 1 Bq,"tiger estate, ibadan oyo",Detached,145000000,29000000,5,5,High,13/07/2025,18/02/2026,2025-07,Oyo
4 Bedroom Mansion,carlton gate estate akobo ibadan oyo,mansion,300000000,75000000,4,4,High,15/08/2025,18/02/2026,2025-08,Oyo
4 Bedroom Bungalow,"housing estate (airforce) , opp kolapo ishola gra, akobo akobo ibadan oyo",Bungalow,80000000,20000000,4,4,High,14/08/2025,18/02/2026,2025-08,Oyo
4 Bedroom Fully Detached Penthouse,kolapo ishola gra akobo ibadan oyo,Detached,300000000,60000000,5,6,High,02/03/2025,18/02/2026,2025-03,Oyo
3 Bedroom Terrace Duplex,"rayfield gardens estate,christopher adebayo alao akala gra ibadan oyo",Terraced,120000000,40000000,3,3,High,20/07/2025,18/02/2026,2025-07,Oyo
4 Bedroom Detached Duplex With 1 Bq,alalubosa gra ibadan oyo,Detached,280000000,70000000,4,4,High,30/10/2025,18/02/2026,2025-10,Oyo
5 Bedroom Detached Duplex With Penthouse/bq,oluyole estate ibadan oyo,Detached,230000000,46000000,5,5,High,06/09/2025,18/02/2026,2025-09,Oyo
4 Bedroom Semi Detached Duplex With Bq,ajah lagos,Detached,145000000,36250000,4,4,High,16/10/2025,18/02/2026,2025-10,Lagos
Newly Built Executive 4 Bedroom Duplex,ogba lagos,duplex,450000000,112500000,4,4,High,14/10/2025,18/02/2026,2025-10,Lagos
Newly Built 4 Bedroom Fully Detached Duplex With Bq,ogba lagos,Detached,350000000,0,0,0,High,17/10/2025,18/02/2026,2025-10,Lagos
6 Bedroom Duplex With Block Of Flats,peace estate command ipaja lagos,Flat/Apartment,200000000,0,0,0,High,21/10/2025,18/02/2026,2025-10,Lagos
4 Bedroom Duplex,p & t estate ipaja lagos,duplex,200000000,50000000,4,4,High,21/10/2025,18/02/2026,2025-10,Lagos
4 Bedroom Semi Detached Duplex With Bq,mende maryland lagos,Detached,200000000,50000000,4,4,High,20/10/2025,18/02/2026,2025-10,Lagos
Newly Built 4 Bedroom Semi Detached Duplex With A Bq,"oko oba, abule egba lagos",Detached,250000000,62500000,4,4,High,20/10/2025,18/02/2026,2025-10,Lagos
4 Bedroom Fully Detached Duplex With Bq,magodo phase 1 ojodu lagos,Detached,450000000,0,0,0,High,21/10/2025,18/02/2026,2025-10,Lagos
4 Bedroom Duplex,highcastle estate p&t ipaja lagos,duplex,200000000,50000000,4,4,High,21/10/2025,18/02/2026,2025-10,Lagos
5 Bedroom Fully Detached Duplex With Bq,magodo phase 1 isheri ojodu lagos,Detached,420000000,84000000,5,5,High,21/10/2025,18/02/2026,2025-10,Lagos
5 Bedroom Fully Detached Duplex With Bq,adeniyi jones ikeja lagos,Detached,700000000,140000000,5,5,High,21/10/2025,18/02/2026,2025-10,Lagos
5 Bedroom Fully Detached Duplex With Bq,magodo gra phase 2 kosofe ikosi lagos,Detached,800000000,0,0,0,High,17/10/2025,18/02/2026,2025-10,Lagos
Mixed Use Building,victoria island lagos,maisonette,25500000000,0,0,0,High,20/10/2025,18/02/2026,2025-10,Lagos
Block Of Flats,ojodu lagos,Flat/Apartment,220000000,0,0,0,High,20/10/2025,18/02/2026,2025-10,Lagos
3200sqm Land,ikeja gra ikeja lagos,land,1300000,0,0,0,Low,15/10/2025,18/02/2026,2025-10,Lagos
5 Bedroom Terraced Duplex,opebi ikeja lagos,Terraced,340000000,68000000,5,5,High,15/10/2025,18/02/2026,2025-10,Lagos
5 Bedroom Fully Detached Duplex With Bq,ajah lagos,Detached,300000000,60000000,5,5,High,16/10/2025,18/02/2026,2025-10,Lagos
4 Bedroom Semi Detached Duplex,maryland lagos,Detached,260000000,65000000,4,4,High,21/10/2025,18/02/2026,2025-10,Lagos
Block 4 Flats,ajao estate isolo lagos,Flat/Apartment,250000000,0,0,0,High,22/10/2025,18/02/2026,2025-10,Lagos
7 Bedroom Mansion,ikeja gra ikeja lagos,mansion,1800000000,257142857,7,7,High,22/10/2025,18/02/2026,2025-10,Lagos
3 Bedroom Semi Detached Duplex,kay farm estate ogba lagos,Detached,140000000,46666667,3,3,High,21/10/2025,18/02/2026,2025-10,Lagos
2/3 Bedroom Maisonette With Bq,surulere lagos,maisonette,105000000,0,0,0,High,20/10/2025,18/02/2026,2025-10,Lagos
Block Of Flats,ogba lagos,Flat/Apartment,300000000,0,0,0,High,16/10/2025,18/02/2026,2025-10,Lagos
New 5 Bedroom Terrace Duplex + Bq,shonibare estate maryland lagos,Terraced,380000000,76000000,5,5,High,23/10/2025,18/02/2026,2025-10,Lagos
6 Bedroom Fully Detached Duplex With Bq,omole phase 1 ojodu lagos,Detached,850000000,141666667,6,6,High,23/10/2025,18/02/2026,2025-10,Lagos
Block Of Flats,kosofe ikosi lagos,Flat/Apartment,450000000,0,0,0,High,24/10/2025,18/02/2026,2025-10,Lagos
3 Bedroom Bungalow,akute obafemi owode ogun,Bungalow,75000000,0,0,0,High,23/10/2025,18/02/2026,2025-10,Ogun
Newly Built 4 Bedroom Terraced Duplex With Bq,ikeja lagos,Terraced,250000000,62500000,4,4,High,15/10/2025,18/02/2026,2025-10,Lagos
2 Units Of 5 Bedroom Detached Duplex With Bq,omole phase 2 ojodu lagos,Detached,12000000000,2400000000,5,5,High,20/10/2025,18/02/2026,2025-10,Lagos
6 Bedroom Duplex,orisunbare alimosho lagos,duplex,270000000,45000000,6,6,High,21/10/2025,18/02/2026,2025-10,Lagos
Newly Built 4 Bedroom Duplex,kay farm estate ogba lagos,duplex,250000000,62500000,4,4,High,21/10/2025,18/02/2026,2025-10,Lagos
5 Bedroom Fully Detached Duplex With Bq,opebi ikeja lagos,Detached,520000000,104000000,5,5,High,16/10/2025,18/02/2026,2025-10,Lagos
4 Bedroom Semi Detached Duplex With Bq,"off college road, ogba lagos",Detached,250000000,62500000,4,4,High,14/10/2025,18/02/2026,2025-10,Lagos
5 Bedrooms Fully Detached Duplex,ikeja gra ikeja lagos,Detached,1200000000,240000000,5,5,High,22/10/2025,18/02/2026,2025-10,Lagos
3 Bedroom Bungalow,alagbole via ojodu berger obafemi owode ogun,Bungalow,65000000,0,0,0,High,23/10/2025,18/02/2026,2025-10,Ogun
4 Bedroom Bungalow,auwon area ojodu lagos,Bungalow,65000000,16250000,4,4,High,23/10/2025,18/02/2026,2025-10,Lagos
Blocks Of Flats,akute via ojodu berger obafemi owode ogun,Flat/Apartment,90000000,0,0,0,High,23/10/2025,18/02/2026,2025-10,Ogun
Newly Built 3 Bedroom Flat,allen avenue ikeja lagos,Flat/Apartment,185000000,61666667,3,3,High,21/10/2025,18/02/2026,2025-10,Lagos
5 Bedroom Terrace Duplex + Bq,shonibare estate maryland lagos,Terraced,380000000,95000000,4,4,High,21/10/2025,18/02/2026,2025-10,Lagos
4 Bedroom Fully Detached Duplex With Bq,omole phase 1 ojodu lagos,Detached,500000000,125000000,4,4,High,21/10/2025,18/02/2026,2025-10,Lagos
3 Bedroom Flats,"awuse estate, opebi ikeja lagos",Flat/Apartment,155000000,51666667,3,3,High,22/10/2025,18/02/2026,2025-10,Lagos
Brand New 3 Bedroom Flat,allen avenue ikeja lagos,Flat/Apartment,185000000,61666667,3,3,High,21/10/2025,18/02/2026,2025-10,Lagos
Automated 4 Bedroom Fully Detached Duplex With Bq,ikotun igando lagos,Detached,450000000,112500000,4,4,High,21/10/2025,18/02/2026,2025-10,Lagos
Newly Built 4 Bedroom Duplex With Bq,egbeda alimosho lagos,duplex,300000000,0,0,0,High,21/10/2025,18/02/2026,2025-10,Lagos
4 Plots Of Land,"facing lagos abeokuta express way, abule egba lagos",land,1000000000,0,0,0,High,15/10/2025,18/02/2026,2025-10,Lagos
2 Storey Building,satellite town amuwo odofin lagos,maisonette,160000000,0,0,0,High,16/10/2025,18/02/2026,2025-10,Lagos
Block Of 4 Flats,ajao estate isolo lagos,Flat/Apartment,250000000,0,0,0,High,16/10/2025,18/02/2026,2025-10,Lagos
2 Bedroom Apartment,ikeja lagos,Flat/Apartment,190000000,95000000,2,2,High,16/10/2025,18/02/2026,2025-10,Lagos
4 Bedroom Fully Detached Duplex With Bq,ajah lagos,Detached,220000000,55000000,4,4,High,20/10/2025,18/02/2026,2025-10,Lagos
5 Bedroom Detached Duplex With Bq,magodo phase 2 ojodu lagos,Detached,500000000,100000000,5,5,High,21/10/2025,18/02/2026,2025-10,Lagos
5 Bedroom Fully Detached House With Bq,adeniyi jones ikeja lagos,Detached,700000000,140000000,5,5,High,22/10/2025,18/02/2026,2025-10,Lagos
3 Bedroom Detached Duplex,"alagbole ,via ojodu berger obafemi owode ogun",Detached,85000000,28333333,3,3,High,23/10/2025,18/02/2026,2025-10,Ogun
5 Bedroom Fully Detached Duplex Plus Bq,opebi ikeja lagos,Detached,520000000,104000000,5,5,High,22/10/2025,18/02/2026,2025-10,Lagos
New 5 Bedroom Terraced Duplex With Bq,shonibare estate maryland lagos,Terraced,380000000,76000000,5,5,High,16/10/2025,18/02/2026,2025-10,Lagos
5 Bedroom Duplex With 2 Bq,ologuneru ibadan oyo,duplex,150000000,0,0,0,High,03/02/2025,18/02/2026,2025-02,Oyo
Newly Built 6 Units Of 2 Bedroom Flat,ojodu lagos,Flat/Apartment,220000000,0,0,0,High,21/10/2025,18/02/2026,2025-10,Lagos
Newly Built 4 Bedroom Terraced Duplex,surulere lagos,Terraced,200000000,50000000,4,4,High,15/10/2025,18/02/2026,2025-10,Lagos
4 Bedroom Detached Bungalow,magboro ojodu lagos,Detached,55000000,0,0,0,High,16/10/2025,18/02/2026,2025-10,Lagos
14 Units Of 2/3 Bedroom Apartment,gbagada lagos,Flat/Apartment,600000000,0,0,0,High,16/10/2025,18/02/2026,2025-10,Lagos
Newly Built 4 Bedroom Duplex,adeniyi jones ikeja lagos,duplex,480000000,120000000,4,4,High,16/10/2025,18/02/2026,2025-10,Lagos
New 3 Bedroom Flat,abule egba lagos,Flat/Apartment,70000000,23333333,3,3,High,20/10/2025,18/02/2026,2025-10,Lagos
10 Floors Building,victoria island lagos,maisonette,25000000000,0,0,0,High,20/10/2025,18/02/2026,2025-10,Lagos
Newly Built 4 Bedroom Semi Detached Duplex With Bq,omole phase 2 ojodu lagos,Detached,380000000,95000000,4,4,High,20/10/2025,18/02/2026,2025-10,Lagos
3 Bedroom Flat,alausa ikeja lagos,Flat/Apartment,250000000,83333333,3,3,High,22/10/2025,18/02/2026,2025-10,Lagos
5 Bedroom Fully Detached Duplex,ikeja gra ikeja lagos,Detached,1100000000,220000000,5,5,High,22/10/2025,18/02/2026,2025-10,Lagos
6 Units Of 2 Bedroom Flat,ikeja lagos,Flat/Apartment,450000000,0,0,0,High,24/10/2025,18/02/2026,2025-10,Lagos
Newly Built 5 Bedroom Fully Detached Duplex With Bq,ikeja lagos,Detached,340000000,68000000,5,5,High,17/10/2025,18/02/2026,2025-10,Lagos
5 Bedroom Semi Detached Duplex With Bq,omole phase 1 ojodu lagos,Detached,470000000,94000000,5,5,High,17/10/2025,18/02/2026,2025-10,Lagos
5 Bedroom Fully Detached Duplex With 2 Bedroom Flat,gemade estate egbeda alimosho lagos,Detached,320000000,0,0,0,High,21/10/2025,18/02/2026,2025-10,Lagos
Commercial Property,marina lagos island lagos,Commercial land,12000000000,0,0,0,High,20/10/2025,18/02/2026,2025-10,Lagos
Spacious 4 Bedroom Semidetached Duplex With Bq,ikota lekki lagos,Detached,170000000,42500000,4,4,High,12/02/2026,18/02/2026,2026-02,Lagos
Massive 4 Bedroom Detached Duplex With Bq,in an estate ikota lekki lagos,Detached,260000000,65000000,4,4,High,16/02/2026,18/02/2026,2026-02,Lagos
Spacious 3 Bedroom Apartment,ibeju lekki lagos,Flat/Apartment,45000000,15000000,3,3,Mid,19/11/2025,18/02/2026,2025-11,Lagos
Spacious 4 Bedroom Semidetached Duplex With Bq,lekki palm city ajah lagos,Detached,130000000,32500000,4,4,High,12/02/2026,18/02/2026,2026-02,Lagos
Newly Built 4 Four Bedroom Fully Detached House,lekki 1 lekki lekki phase 1 lekki lagos,Detached,50000000,12500000,4,4,Mid,03/12/2025,18/02/2026,2025-12,Lagos
3 Bedroom Terrace Duplex With Bq,lagos business school axis off lekki epe expressway ajah lagos,Terraced,90000000,30000000,3,3,High,13/02/2026,18/02/2026,2026-02,Lagos
Spacious 4 Bedroom Semidetached Duplex With Pool,ikota lekki lagos,Detached,220000000,55000000,4,4,High,12/02/2026,18/02/2026,2026-02,Lagos
Newly Built 2 Bedroom Terrace Duplex With Bq,lekki scheme 2 ajah lagos,Terraced,110000000,55000000,2,2,High,12/02/2026,18/02/2026,2026-02,Lagos
Very Spacious 5 Bedroom Detached Duplex With Bq,ologolo lekki lagos,Detached,250000000,50000000,5,5,High,16/02/2026,18/02/2026,2026-02,Lagos
Contemporary 4 Bedroom Semidetached Duplex With Bq,mobil road ikota lekki lagos,Detached,150000000,37500000,4,4,High,12/02/2026,18/02/2026,2026-02,Lagos
Contemporary 4 Bedroom Semidetached Duplex With Bq,lekki palm city ajah lagos,Detached,140000000,35000000,4,4,High,12/02/2026,18/02/2026,2026-02,Lagos
4 Bedroom Semi Detached Duplex With Bq,ado ajah lagos,Detached,150000000,37500000,4,4,High,13/11/2025,18/02/2026,2025-11,Lagos
"Mini Estate,10 Units Of Furnished 3 Bedroom Flat",hakeem dickson road lekki phase 1 lekki lagos,Flat/Apartment,4000000000,1333333333,3,3,High,31/01/2026,18/02/2026,2026-01,Lagos
4 Bedroom Semi Detached Duplex With Bq,chevron lekki lagos,Detached,250000000,62500000,4,4,High,13/01/2026,18/02/2026,2026-01,Lagos
3 Bedroom Terrace Duplex,ikate lekki lagos,Terraced,175000000,58333333,3,4,High,29/01/2026,18/02/2026,2026-01,Lagos
3 Bedroom Terrace Duplex,chevron lekki lagos,Terraced,180000000,60000000,3,3,High,13/01/2026,18/02/2026,2026-01,Lagos
10 Units Of 1 Bedroom Apartment,abijo gra ajah lagos,Flat/Apartment,160000000,160000000,1,1,High,10/01/2026,18/02/2026,2026-01,Lagos
5 Bedroom Semi Detached House,old ikoyi ikoyi lagos,Detached,1395000000,279000000,5,5,High,16/01/2026,18/02/2026,2026-01,Lagos
5 Bedroom Fully Detached House,"buena vista estate, orchid road orchid lekki lagos",Detached,300000000,60000000,5,5,High,21/01/2026,18/02/2026,2026-01,Lagos
