title,location,property_type,price,price_per_bedroom,bedrooms,bathrooms,price_category,added_date,updated_date,month_added,state
Newly Built 4 Bedroom Terrace Duplex With Bq,lekki 1 lagos freedom way lekki lagos,Terraced,350000000,87500000,4,4,High,20/01/2026,18/02/2026,2026-01,Lagos
3 Bedroom Terraced Duplex,ikota lekki lagos,Terraced,90000000,30000000,3,3,High,17/02/2026,19/02/2026,2026-02,Lagos
5 Bedroom Detached House With Swimming Pool,ajah lagos,Detached,185000000,37000000,5,5,High,16/02/2026,19/02/2026,2026-02,Lagos
5bed Detached+2bq!!!,ikeja gra ikeja lagos,Detached,1000000000,200000000,5,6,High,24/03/2025,19/02/2026,2025-03,Lagos
3 Bedroom Terraced Duplex,"behind lagos business school, sangotedo ajah lagos",Terraced,118800000,39600000,3,3,High,24/10/2025,19/02/2026,2025-10,Lagos
3 Bedroom Duplex With Private Compound,"atlantic layout alaska, abraham adesanya estate ajah lagos",duplex,75000000,25000000,3,3,High,24/10/2025,19/02/2026,2025-10,Lagos
Luxury 4 Bedroom Terraced Duplex,"near lekki scheme2, abraham adesanya estate ajah lagos",Terraced,125000000,31250000,4,4,High,30/11/2025,19/02/2026,2025-11,Lagos
4 Bedroom Duplex,by lagos business school ajah olokonla ajah lagos,duplex,170000,42500,4,4,Low,21/12/2025,19/02/2026,2025-12,Lagos
4 Bedroom Semi Detached Duplex,ogidan sangotedo ajah lagos,Detached,150000000,37500000,4,4,High,05/01/2026,19/02/2026,2026-01,Lagos
3 Bedroom Apartment,lekki scheme 2 abraham adesanya estate ajah lagos,Flat/Apartment,80000000,26666667,3,3,High,08/01/2026,19/02/2026,2026-01,Lagos
5 Bedroom Duplex All Ensuite With 2 Bedroom Bq,parkview estate ikoyi lagos,duplex,1750000000,350000000,5,6,High,17/02/2026,18/02/2026,2026-02,Lagos
2 And 3 Bedroom Apartment,lekki scheme2 abraham adesanya estate ajah lagos,Flat/Apartment,70000000,35000000,2,2,High,08/01/2026,19/02/2026,2026-01,Lagos
Luxury 4 Bedroom Terraced Duplex,monastery road shoprite sangotedo ajah lagos,Terraced,108000000,27000000,4,4,High,09/01/2026,19/02/2026,2026-01,Lagos
3 Bedroom Terraced Duplex,atlantic nominee ajah abraham adesanya estate ajah lagos,Terraced,105000000,35000000,3,3,High,17/02/2026,19/02/2026,2026-02,Lagos
5bed Penthouse+bq..,"banana island road, ikoyi lagos",penthouse,2700000000,540000000,5,6,High,16/01/2026,19/02/2026,2026-01,Lagos
5bed Detached+bq..,banana island ikoyi lagos,Detached,9000000000,1800000000,5,6,High,16/01/2026,19/02/2026,2026-01,Lagos
5bed Detached+bq,ikoyi lagos,Detached,3750000000,750000000,5,6,High,27/01/2026,19/02/2026,2026-01,Lagos
5bed Semi Detached+bq,ikeja gra ikeja lagos,Detached,850000000,170000000,5,6,High,29/01/2026,19/02/2026,2026-01,Lagos
5bed+ Bq..,omole phase 1 ojodu lagos,5 bedroom,700000000,140000000,5,6,High,01/02/2026,19/02/2026,2026-02,Lagos
5bed Detached+bq.,banana island ikoyi lagos,Detached,5000000000,1000000000,5,6,High,08/02/2026,19/02/2026,2026-02,Lagos
3bed Apartment+bq,banana island ikoyi lagos,Flat/Apartment,1800000000,600000000,3,4,High,09/02/2026,19/02/2026,2026-02,Lagos
2 Bedroom Apartment,igbo efon lekki lagos,Flat/Apartment,65000000,32500000,2,2,High,10/10/2025,18/02/2026,2025-10,Lagos
2 Bedroom Apartment,lekki phase 1 lekki lagos,Flat/Apartment,270000000,0,0,0,High,16/05/2025,18/02/2026,2025-05,Lagos
Developer's Delight Waterfront Land At Chevron,chevron drive lekki lagos,land,180000000,0,0,0,High,23/12/2025,18/02/2026,2025-12,Lagos
Luxury 4 Bedroom Terraced Duplex With Bq,lekki phase 1 lekki lagos,Terraced,400000000,100000000,4,4,High,25/07/2025,18/02/2026,2025-07,Lagos
5 Bedroom Fully Detached Duplex With Bq,chevron lekki lagos,Detached,450000000,90000000,5,5,High,12/01/2026,18/02/2026,2026-01,Lagos
"Fantastic 5 Bedroom Detached Duplex With Pool, Cinema",ologolo lekki lagos,Detached,550000000,110000000,5,6,High,07/02/2026,18/02/2026,2026-02,Lagos
Office,toyin street ikeja lagos,office/ office space,750000000,0,0,0,High,14/05/2025,18/02/2026,2025-05,Lagos
2 Units Of 4 Bedroom Semi Detached Duplex With Bq,ogudu lagos,Detached,245000000,0,0,0,High,13/05/2025,18/02/2026,2025-05,Lagos
4 Bedroom Semi Detached Duplex With Bq,idado lekki lagos,Detached,130000000,32500000,4,4,High,16/02/2026,19/02/2026,2026-02,Lagos
A Unit Of 4 Bedroom Fully Detached Duplex,carlton gate estate akobo ibadan oyo,Detached,135000000,33750000,4,4,High,04/02/2026,18/02/2026,2026-02,Oyo
Contemporary 5 Bedroom Mansion,cowrie creek estate ikate lekki lagos,5 bedroom,2300000000,460000000,5,5,High,12/02/2026,18/02/2026,2026-02,Lagos
6 Bedroom Fully Detached Duplex With Bq,"dantata district estate, ahmadu bello way gwarinpa abuja",Detached,650000000,108333333,6,6,High,23/01/2026,18/02/2026,2026-01,Abuja
Exquisitely Furnished 5 Bed Waterfront Mansion,banana island ikoyi lagos,5 bedroom,12000000000,2400000000,5,6,High,09/02/2026,18/02/2026,2026-02,Lagos
A Spacious 2 Bedroom Apartment That’s Fully Serviced,ikate lekki lagos,Flat/Apartment,220000000,110000000,2,2,High,03/02/2026,18/02/2026,2026-02,Lagos
5bed Detached+2bq,banana island ikoyi lagos,Detached,7500000000,1500000000,5,6,High,16/02/2026,19/02/2026,2026-02,Lagos
7 Bedroom Waterfront Mansion,banana island ikoyi lagos,mansion,22500000000,3214285714,7,8,High,03/01/2026,18/02/2026,2026-01,Lagos
5 Bedroom Fully Detached Duplex With Bq & Pool,"lekki palm city, ado ajah lagos",Detached,165000000,33000000,5,5,High,03/11/2025,18/02/2026,2025-11,Lagos
5 Bedrooms Detached Home With Swimming Pool & Bq,harris drive vgc lekki lagos,Detached,320000000,64000000,5,5,High,06/02/2026,18/02/2026,2026-02,Lagos
Semi Finished Premium 6 Bedroom Detached Duplex,before h medix life camp abuja,Detached,700000009,116666668,6,6,High,26/01/2026,18/02/2026,2026-01,Abuja
Brand New Smart Home With Parking For 10 Cars In Omole,omole phase 1 ikeja lagos ikeja lagos,maisonette,600000000,120000000,5,6,High,15/05/2025,18/02/2026,2025-05,Lagos
Luxurious Spacious 3 Bedroom Apartment,rock hampton katampe abuja,Flat/Apartment,375000000,125000000,3,3,High,07/10/2025,18/02/2026,2025-10,Abuja
4 Bedroom Maisonette,lekki phase 1 lekki lagos,maisonette,430000000,107500000,4,4,High,12/01/2026,09/02/2026,2026-01,Lagos
Furnished 4bed+bq..,ikeja gra ikeja lagos,maisonette,830000000,207500000,4,5,High,17/02/2026,19/02/2026,2026-02,Lagos
5 Bedroom Fully Detached Duplex,toll gate chevron lekki lagos,Detached,420000000,84000000,5,5,High,09/04/2025,18/02/2026,2025-04,Lagos
Newly Built Two Terrace With A Private Compound,ajah lekki lagos ajah lagos,Terraced,90000000,45000000,2,2,High,03/02/2026,18/02/2026,2026-02,Lagos
Luxury 4 Bedroom Terrace Duplex With Bq,by coza church guzape abuja,Terraced,400000000,100000000,4,4,High,29/01/2026,18/02/2026,2026-01,Abuja
600sqm & 1020sqm Plots In A Beautiful Estate,maiyegun beach estate jakande lekki phase 1 lekki lagos,land,500000000,0,0,0,High,14/10/2025,18/02/2026,2025-10,Lagos
4 Bedroom Terraced Duplex With Bq,"rock hampton, katampe abuja",Terraced,216000000,54000000,4,4,High,13/10/2025,18/02/2026,2025-10,Abuja
4 Bedroom Duplex,napier gardens estates by vgc lekki vgc lekki lagos,duplex,450000000,112500000,4,4,High,18/01/2026,18/02/2026,2026-01,Lagos
5 Bedroom Fully Detached Duplex,chevron lekki lagos,Detached,480000000,96000000,5,5,High,23/01/2026,18/02/2026,2026-01,Lagos
6 Bedroom Waterfront Detached Home,banana island ikoyi lagos,Detached,7500000000,1250000000,6,6,High,08/09/2025,18/02/2026,2025-09,Lagos
5 Bedroom Fully Detached Duplex With Bq,lekki phase 1 lekki lagos,Detached,750000000,150000000,5,5,High,28/11/2025,18/02/2026,2025-11,Lagos
6 Bedroom Fully Detached Duplex,chevron lekki lagos,Detached,750000000,125000000,6,6,High,02/01/2026,18/02/2026,2026-01,Lagos
Brand New 2 Bedroom Apartment,capital hub mabushi abuja,Flat/Apartment,120000000,60000000,2,2,High,23/01/2026,18/02/2026,2026-01,Abuja
3 Bed Apartment With Pool & Gym,adeniyi jones ikeja lagos,Flat/Apartment,265000000,88333333,3,3,High,16/10/2025,18/02/2026,2025-10,Lagos
2 Bedroom Apartment With Bq,ikate lekki lagos,Flat/Apartment,220000000,110000000,2,2,High,18/07/2025,18/02/2026,2025-07,Lagos
Newly Built 5 Bedroom Detached Duplex,aso villa asokoro abuja,Detached,3500000000,700000000,5,5,High,21/01/2026,18/02/2026,2026-01,Abuja
4 Bedroom Terraced Duplex With Bq,osborne osborne foreshore estate ikoyi lagos,Terraced,350000000,87500000,4,4,High,17/09/2025,18/02/2026,2025-09,Lagos
Contemporary 5 Bedroom Detached Duplex,ikota by mega chicken lekki lagos,Detached,420000000,84000000,5,5,High,01/02/2026,18/02/2026,2026-02,Lagos
"Large Expanse Of Waterfront Land Measuring 2,270 Sqms",banana island ikoyi lagos,land,9100000000,0,0,0,High,12/02/2026,18/02/2026,2026-02,Lagos
4 Bedroom Duplex All Ensuite With 2 Bedroom Bq,parkview estate ikoyi lagos,duplex,1650000000,412500000,4,5,High,17/02/2026,18/02/2026,2026-02,Lagos
Contemporary Fully Furnished 5 Bedroom Duplex,vgc lekki lagos,duplex,850000000,170000000,5,5,High,29/01/2026,18/02/2026,2026-01,Lagos
Land,parkview estate ikoyi lagos,land,1300000000,0,0,0,High,25/12/2025,18/02/2026,2025-12,Lagos
Well Maintained 5 Bedroom Detached Duplex,lekki phase 1 lekki lagos,Detached,45000000,9000000,5,5,Mid,19/01/2026,18/02/2026,2026-01,Lagos
Newly Built 1 Bedroom Apartment,freedom way lekki lagos,Flat/Apartment,140000000,140000000,1,1,High,14/12/2025,18/02/2026,2025-12,Lagos
Commercial 5 Bedroom Fully Detached Duplex + 3bq,victoria island lagos,Detached,90000000,0,0,0,High,20/01/2026,03/12/2025,2026-01,Lagos
Fully Functioning 18 Rooms Hotel,alausa ikeja lagos,hotel/guest house,680000000,68000000,10,10,High,05/10/2025,18/02/2026,2025-10,Lagos
A Contemporary 4 Bed Terrace Duplex,lekki phase 1 lekki lagos,Terraced,650000000,162500000,4,4,High,04/02/2026,18/02/2026,2026-02,Lagos
5 Bedroom Duplex With Bq,lekki phase 1 lekki lagos,duplex,35000000,7000000,5,5,Mid,12/01/2026,09/02/2026,2026-01,Lagos
Spacious 3 Bedroom Terrace Duplex,abraham adesanya estate ajah lagos,Terraced,105000000,35000000,3,3,High,20/01/2026,18/02/2026,2026-01,Lagos
Distress 10 Bedroom Mansion With Bq+1500sqm,zarthet wuye abuja,land,950000000,95000000,10,10,High,10/08/2025,18/02/2026,2025-08,Abuja
5 Bedroom Detached Duplex,chevron lekki lagos,Detached,1500000000,300000000,5,5,High,23/09/2025,18/02/2026,2025-09,Lagos
2965sqm Office Building On 7 Floors,victoria island lagos,office/ office space,22500000000,0,0,0,High,12/11/2025,18/02/2026,2025-11,Lagos
Own A Luxury Mansion In Banana Island,banana island ikoyi lagos,land,6750000000,1350000000,5,5,High,10/02/2026,18/02/2026,2026-02,Lagos
4 Bedroom Duplex,bluegate oluyole estate ibadan oyo,duplex,310000000,0,0,0,High,01/09/2025,18/02/2026,2025-09,Oyo
Functional 37 Rooms Hotel,okota ajao estate isolo lagos,hotel/guest house,1000000000,0,0,0,High,21/07/2025,18/02/2026,2025-07,Lagos
Fully Furnished 3 Bedroom Apartment For Sale,admiralty road lekki lagos,Flat/Apartment,420000000,140000000,3,4,High,18/02/2026,18/02/2026,2026-02,Lagos
Luxury 5 Bedroom Terrace House With Bq,parkview ikoyi lagos parkview estate ikoyi lagos,Terraced,1400000000,280000000,5,5,High,02/02/2026,18/02/2026,2026-02,Lagos
Prime Industrial Land,ijora apapa lagos,land,1500000000,0,0,0,High,30/01/2026,18/02/2026,2026-01,Lagos
3 Bedroom Terrace Duplex,fagba agege lagos,Terraced,130000000,43333333,3,3,High,24/01/2026,18/02/2026,2026-01,Lagos
Fully Serviced 3 Bedroom Luxury Apartment,old ikoyi ikoyi lagos,Flat/Apartment,35000000,11666667,3,3,Mid,30/10/2025,18/02/2026,2025-10,Lagos
3 Bedroom Waterfront Duplex,lekki phase 1 lekki lagos,duplex,40000000,13333333,3,3,Mid,13/01/2026,09/02/2026,2026-01,Lagos
Newly Built 4 Bedroom Terrace Duplex + Bq,orchid lekki lagos,Terraced,9000000,2250000,4,4,Low,03/02/2026,18/02/2026,2026-02,Lagos
4bed Massionette+bq,shonibare estate maryland lagos,maisonette,800000000,200000000,4,5,High,16/02/2026,19/02/2026,2026-02,Lagos
Luxury 2 Bedroom Apartment With Elevator,"spar road, ikate lekki lagos",Flat/Apartment,220000000,110000000,2,2,High,09/01/2026,18/02/2026,2026-01,Lagos
Furnished 4 Bedroom Terrace Duplex With Bq,guzape abuja,Terraced,450000000,112500000,4,4,High,28/01/2026,18/02/2026,2026-01,Abuja
Fully Operational Rice Milling Facility,idu industrial (institution and research) abuja,maisonette,10000000000,0,0,0,High,01/02/2026,18/02/2026,2026-02,Abuja
2 Bedroom Flat,off maitama kubwa express katampe main abuja,Flat/Apartment,165000000,82500000,2,2,High,13/01/2026,18/02/2026,2026-01,Abuja
Newly Built 3 Bedroom Flat,"by turkish hospital, idu abuja",Flat/Apartment,145000000,48333333,3,3,High,19/01/2026,18/02/2026,2026-01,Abuja
Newly Built 1 Bedroom Flat,by ceder crest hospital apo abuja,Flat/Apartment,65000000,65000000,1,1,High,21/01/2026,18/02/2026,2026-01,Abuja
Newly Built 3 Bedroom With A Bq,by american international school durumi abuja,maisonette,120000000,40000000,3,3,High,10/02/2026,18/02/2026,2026-02,Abuja
Newly Built 5 Bedroom Detached Duplex With Bq,wuye abuja,Detached,700000000,140000000,5,5,High,23/01/2026,18/02/2026,2026-01,Abuja
3 Bedroom Flat,off maitama kubwa express way katampe main abuja,Flat/Apartment,195000000,65000000,3,3,High,13/01/2026,18/02/2026,2026-01,Abuja
A Fully Furnished 3 Bedroom Flat,by stella marris school life camp abuja,Flat/Apartment,135000000,45000000,3,3,High,16/01/2026,18/02/2026,2026-01,Abuja
Newly Built 3 Bedroom Flat With A Bq,life camp abuja,Flat/Apartment,130000000,43333333,3,3,High,06/02/2026,18/02/2026,2026-02,Abuja
Fully Furnished 3 Bedroom Flat,mabushi abuja,Flat/Apartment,155000000,51666667,3,3,High,04/02/2026,18/02/2026,2026-02,Abuja
Standard 3 Bedroom With A Bq,brains and hammers estate galadimawa abuja,maisonette,120000000,40000000,3,3,High,05/02/2026,18/02/2026,2026-02,Abuja
Newly Built 4 Bedroom Detached Duplex With A Bq,"apo resettlement by the new express, apo abuja",Detached,300000000,75000000,4,4,High,16/01/2026,18/02/2026,2026-01,Abuja
Newly Built 2 Bedroom Flat,by turkish hospital idu abuja,Flat/Apartment,58000000,29000000,2,2,High,20/01/2026,18/02/2026,2026-01,Abuja
Newly Built 2 Bedroom Duplex,by urban shelter lokogoma abuja,duplex,95000000,47500000,2,2,High,14/01/2026,18/02/2026,2026-01,Abuja
Newly Built 2 Bedroom Flat,close to turkish hospital idu abuja,Flat/Apartment,70000000,35000000,2,2,High,02/01/2026,18/02/2026,2026-01,Abuja
Newly Built 2 Bedroom Flat,behind capital hub mabushi abuja,Flat/Apartment,120000000,40000000,3,3,High,04/02/2026,18/02/2026,2026-02,Abuja
Newly Built 3 Bedroom Flat,mabushi abuja,Flat/Apartment,160000000,53333333,3,3,High,26/01/2026,18/02/2026,2026-01,Abuja
Newly Built 3 Bedroom Flat With Bq,"soe estate, life camp abuja",Flat/Apartment,95000000,31666667,3,3,High,02/01/2026,18/02/2026,2026-01,Abuja
Standard 3 Bedroom Flat With A Bq,"efab global estate, idu abuja",Flat/Apartment,150000000,50000000,3,3,High,16/01/2026,18/02/2026,2026-01,Abuja
Fully Furnished 3 Bedroom With Swimming Pool,tarred road life camp abuja,maisonette,120000000,40000000,3,3,High,04/02/2026,18/02/2026,2026-02,Abuja
1 Bedroom Apartment,dr adewale oshin lekki phase 1 lekki lagos,Flat/Apartment,5000000,5000000,1,1,Low,03/01/2026,18/02/2026,2026-01,Lagos
Distress 7units Of 5bedroom Terraces Duplexes +bq,close to nnpc guzape abuja,Flat/Apartment,2500000000,0,0,0,High,15/07/2025,18/02/2026,2025-07,Abuja
Luxurious 4 Bedroom Terraced Duplex With Bq,"american international school, durumi abuja",Terraced,240000000,60000000,4,4,High,15/12/2025,18/02/2026,2025-12,Abuja
5 Bedroom Fully Detached Duplex,ikoyi lagos,Detached,3500000000,700000000,5,5,High,23/01/2026,18/02/2026,2026-01,Lagos
Distress 6units Of 4 Bedroom Terrace Duplex With Bq,linder chucker crescent close to minister's house asokoro abuja,Flat/Apartment,2500000000,0,0,0,High,03/10/2025,18/02/2026,2025-10,Abuja
Furnished Penthouse 3 Bedroom Apartment With Bq,old ikoyi old ikoyi ikoyi lagos,Flat/Apartment,45000000,15000000,3,3,Mid,19/01/2026,18/02/2026,2026-01,Lagos
5 Bedroom Terrace Homes,parkview estate ikoyi lagos,Terraced,1400000000,280000000,5,5,High,17/02/2026,18/02/2026,2026-02,Lagos
Luxury 5 Bedroom Fully Detached Duplex,apo resettlement apo abuja,Detached,480000000,96000000,5,5,High,12/01/2026,18/02/2026,2026-01,Abuja
Orange Mall,katampe main abuja,plaza|mall|complex,73000000,0,0,0,High,16/09/2025,18/02/2026,2025-09,Abuja
160 Rooms,airport by presidential wing lugbe abuja,maisonette,15000000000,0,0,0,High,22/09/2025,18/02/2026,2025-09,Abuja
3 Bedroom Apartment,wuye dakibiyu after ivy aparyms wuye abuja,Flat/Apartment,120000000,40000000,3,3,High,25/01/2026,18/02/2026,2026-01,Abuja
"Super Luxury 4 Bed Maisonette +bq, Elevator, Pool & Gym",adeniyi jones ikeja lagos,maisonette,425000,106250,4,5,Low,07/10/2025,18/02/2026,2025-10,Lagos
Furnished 7 Bedroom Detached Duplex With Elevator,by market square kado abuja,Detached,1500000000,214285714,7,7,High,19/12/2025,18/02/2026,2025-12,Abuja
Fully Furnished 5 Bedroom Duplex + Inverter & Bq,ikate lekki lagos,duplex,32000000,6400000,5,5,Mid,10/02/2026,18/02/2026,2026-02,Lagos
4 Bedroom Fully Detached Duplex With Bq,stargate oluyole estate ibadan oyo,Detached,220000000,0,0,0,High,26/06/2025,18/02/2026,2025-06,Oyo
Newly Built 4 Bedroom Terrace Duplex,guzape abuja,Terraced,455000000,113750000,4,4,High,23/01/2026,18/02/2026,2026-01,Abuja
Newly Built 4 Bedroom Terrace Duplex,ikate lekki lagos,Terraced,20000000,5000000,4,4,Mid,17/01/2026,18/02/2026,2026-01,Lagos
1 Bedroom Apartment,aina afolayan bodija ibadan oyo,Flat/Apartment,100000,100000,1,2,Low,08/01/2026,18/02/2026,2026-01,Oyo
Sweet And Beautiful Fully Furnished Shared Apartment,mobil road ikota lekki lagos,Flat/Apartment,2000000,2000000,1,1,Low,30/01/2026,18/02/2026,2026-01,Lagos
Newly Built 4 Bedroom Terrace Duplex With Bq,katampe extension katampe abuja,Terraced,370000000,92500000,4,4,High,31/01/2026,18/02/2026,2026-01,Abuja
4 Bedroom Semi Detached Home,ikate lekki lagos,Detached,360000000,90000000,4,4,High,21/01/2026,18/02/2026,2026-01,Lagos
Developer's Delight 624sqm Residential Plot For Sale,osapa london lekki lagos,land,250000000,0,0,0,High,31/12/2025,18/02/2026,2025-12,Lagos
Massive 4 Bedroom Terraced Duplex With Bq,main maitama abuja,Terraced,1500000000,375000000,4,4,High,06/10/2025,18/02/2026,2025-10,Abuja
Newly Built 3 Bedroom Apartment,dantata district estate off 3rd avenue gwarinpa abuja,Flat/Apartment,160000000,53333333,3,3,High,25/01/2026,18/02/2026,2026-01,Abuja
4 Bedroom Duplex,close to ogudu lagos,duplex,245000000,61250000,4,5,High,15/05/2025,18/02/2026,2025-05,Lagos
Luxury 4 Bedroom Apartment With All Amenities,old ikoyi ikoyi lagos,Flat/Apartment,55000000,13750000,4,4,High,19/01/2026,18/02/2026,2026-01,Lagos
4 Bedroom Terraced Duplex With Bq,spar market life camp abuja,Terraced,150000000,30000000,5,5,High,14/10/2025,18/02/2026,2025-10,Abuja
2 Bedroom Apartment,oniru victoria island lagos,Flat/Apartment,300000000,150000000,2,2,High,14/01/2026,18/02/2026,2026-01,Lagos
2 Bedroom Maisonette,"off freedom way, lekki phase 1 freedom way lekki lagos",maisonette,2500000,1250000,2,2,Low,11/02/2026,18/02/2026,2026-02,Lagos
Serviced 2bed+bq,lekki phase 1 lekki lagos,maisonette,270000000,135000000,2,3,High,16/02/2026,19/02/2026,2026-02,Lagos
5bed Detached+bq,"cowrie creek est, ikate lekki lagos",Detached,2300000000,460000000,5,6,High,16/02/2026,19/02/2026,2026-02,Lagos
4bed Semi Detached+bq,magodo gra phase 1 ojodu lagos,Detached,350000000,87500000,4,5,High,17/02/2026,19/02/2026,2026-02,Lagos
2bed Penthouse+bq,lekki phase 1 lekki lagos,penthouse,800000000,400000000,2,3,High,18/02/2026,19/02/2026,2026-02,Lagos
Blocks Of Flats,mende maryland lagos,Flat/Apartment,350000000,0,0,0,High,31/01/2026,19/02/2026,2026-01,Lagos
Half Plot Of Land Facing Expressway,ebute ogolonto road ebute ikorodu lagos,land,30000000,0,0,0,Mid,16/02/2026,19/02/2026,2026-02,Lagos
Furnished 1 Bedroom Apartment,lekki phase 1 lekki lagos,Flat/Apartment,140000000,140000000,1,1,High,01/02/2026,19/02/2026,2026-02,Lagos
6 Bedroom Detached Duplex With Bq,ayobo ipaja lagos,Detached,220000000,36666667,6,6,High,28/01/2026,18/02/2026,2026-01,Lagos
Newly Built 5 Bedroom Fully Detached Duplex,banana island ikoyi lagos,Detached,6300000000,1260000000,5,5,High,17/12/2025,18/02/2026,2025-12,Lagos
"Plots For In Genesis Court, Olokonla.@n280,000 Per Sqm",genesis court olokonla ajah lagos,land,280000,0,0,0,Low,02/02/2026,18/02/2026,2026-02,Lagos
Luxury 5 Bedroom Detached Duplex With Bq,lekki phase 1 lekki lagos,Detached,850000000,170000000,5,5,High,01/02/2026,18/02/2026,2026-02,Lagos
Newly Built Smart 4 Bedroom Terraced Duplex,ikate lekki lagos,Terraced,400000000,100000000,4,5,High,09/01/2026,18/02/2026,2026-01,Lagos
4 Bedroom Terrace Duplex,dopemu cement agege lagos,Terraced,250000000,62500000,4,5,High,18/02/2026,18/02/2026,2026-02,Lagos
Newly Built Fully Detached 5 Bedroom Duplex,cement agege lagos,Detached,350000000,70000000,5,6,High,18/02/2026,18/02/2026,2026-02,Lagos
3 Plot Of Land,greenw park olokonla ajah lagos,land,50000000,0,0,0,Mid,28/01/2026,18/02/2026,2026-01,Lagos
6 Bedroom Duplex,ikoyi lagos,duplex,7500000000,1250000000,6,6,High,17/12/2025,18/02/2026,2025-12,Lagos
Newly Built 4 Bedroom Terrace Duplex,lekki phase 1 lekki lagos,Terraced,400000000,100000000,4,5,High,20/01/2026,18/02/2026,2026-01,Lagos
4 Bedroom Terrace Duplex + Bq,off fatai arobieke lekki phase 1 lekki lagos,Terraced,600000000,150000000,4,4,High,28/01/2026,18/02/2026,2026-01,Lagos
5 Bedroom Duplex,lekki phase 1 lekki lagos,duplex,1500000000,300000000,5,5,High,17/12/2025,18/02/2026,2025-12,Lagos
5 Bedroom Detached Smart Home,lekki phase 1 lekki lagos,Detached,1500000000,300000000,5,5,High,17/12/2025,18/02/2026,2025-12,Lagos
Magnificent Waterfront 6 Bedroom Fully Detached Duplex,old ikoyi ikoyi lagos,Detached,7500000000,1250000000,6,6,High,17/12/2025,18/02/2026,2025-12,Lagos
4 Bedroom Terraced Duplex With Bq,"off admiralty way, lekki phase 1 lekki lagos",Terraced,450000000,112500000,4,4,High,19/01/2026,18/02/2026,2026-01,Lagos
Prime Commercial Land For Sale In Ikeja Cbd,ikeja lagos,Commercial land,2100000000,0,0,0,High,18/02/2026,18/02/2026,2026-02,Lagos
Exquisite Decent 4 Bedroom Semi Detached Duplex,ologolo lekki lagos,Detached,260000000,65000000,4,4,High,16/01/2026,18/02/2026,2026-01,Lagos
4 Bedroom Semi Detached Duplex With Bq,ologolo lekki lagos,Detached,260000000,65000000,4,4,High,17/01/2026,18/02/2026,2026-01,Lagos
Newly Built 4 Bedroom Detached Duplex,banana island ikoyi lagos,Detached,2000000000,500000000,4,4,High,14/01/2026,18/02/2026,2026-01,Lagos
2 Bedroom Apartment,lekki lagos,Flat/Apartment,180000000,90000000,2,3,High,15/12/2025,18/02/2026,2025-12,Lagos
230 Sqm Open Space Office In Ikeja Gra,oduduwa way ikeja gra lagos mainland ikeja gra ikeja lagos,office/ office space,50000000,0,0,0,Mid,08/09/2025,18/02/2026,2025-09,Lagos
2 Bedroom Maisonette,oniru victoria island lagos,maisonette,450000000,225000000,2,2,High,14/12/2025,18/02/2026,2025-12,Lagos
2 Bedroom Apartment,admiralty road lekki lagos,Flat/Apartment,280000000,140000000,2,2,High,22/12/2025,18/02/2026,2025-12,Lagos
2 Bedroom Maisonette,freedom way lekki lagos,maisonette,200000000,100000000,2,2,High,14/12/2025,18/02/2026,2025-12,Lagos
5 Bedroom Duplex Lekki Phase 1,admiralty road lekki lagos,duplex,750000000,150000000,5,5,High,22/12/2025,18/02/2026,2025-12,Lagos
5 Bedroom Detached Duplex,lekki phase 1 lekki lagos,Detached,1200000000,240000000,5,5,High,22/12/2025,18/02/2026,2025-12,Lagos
Fully Serviced 5 Bedroom Detached House,osapa london lekki lagos,Detached,500000000,100000000,5,5,High,13/08/2025,18/02/2026,2025-08,Lagos
2 Bedroom Apartment,ikate lekki lagos,Flat/Apartment,130000000,65000000,2,3,High,15/12/2025,18/02/2026,2025-12,Lagos
4 Bedroom Terraced Duplex,old ikoyi ikoyi lagos,Terraced,1200000000,300000000,4,5,High,15/12/2025,18/02/2026,2025-12,Lagos
Massive 5 Bedroom Detached Duplex With Cinema,royal garden estate ajiwe ajah lagos,Detached,750000000,150000000,5,5,High,18/02/2026,,2026-02,Lagos
3 Bedroom Terrace Duplex,"lekki palm city estate , lekki scheme 2 ajah lagos",Terraced,90000000,30000000,3,3,High,13/11/2025,18/02/2026,2025-11,Lagos
Prime Land Measuring 2100sqm,"directly facing moshood abiola way, igamu, surulere lagos",land,950000000,0,0,0,High,28/01/2026,18/02/2026,2026-01,Lagos
Spacious 4 Bedroom Detached Duplex,fagba agege lagos,Detached,260000000,65000000,4,4,High,29/01/2026,18/02/2026,2026-01,Lagos
Luxury 3 Bedroom Apartment,phase ii osborne foreshore estate ikoyi lagos,Flat/Apartment,470000000,156666667,3,3,High,28/01/2026,18/02/2026,2026-01,Lagos
Spacious 5 Bedroom Detached Duplex,idado lekki lagos,Detached,270000000,54000000,5,5,High,28/01/2026,18/02/2026,2026-01,Lagos
5 Bedroom Detached Duplex With Bq,ologolo lekki lagos,Detached,300000000,60000000,5,5,High,28/01/2026,18/02/2026,2026-01,Lagos
Land Measuring 1500sqm With An Old Structure,"palm grove estate, ilupeju lagos",land,1100000000,0,0,0,High,28/01/2026,18/02/2026,2026-01,Lagos
Luxury 5 Bedroom Fully Detached Duplex,parkview estate ikoyi lagos,Detached,70000000,14000000,5,6,High,17/02/2026,18/02/2026,2026-02,Lagos
4 Bedroom Duplex+2 Units Of 3 Bedroom Flat,"diamond estate, command, ipaja lagos",Flat/Apartment,370000000,92500000,4,4,High,28/01/2026,18/02/2026,2026-01,Lagos
4 Bedroom Flat,"block2 house3, alexandra quarter,kolande abayomi st, songotedo, lekki lagos",Flat/Apartment,110000000,27500000,4,4,High,10/03/2025,18/02/2026,2025-03,Lagos
Newly Built 5 Bedroom Detached Duplex With Bq,gbagada lagos,Detached,420000000,84000000,5,5,High,28/01/2026,18/02/2026,2026-01,Lagos
Prime Land Measuring 4000sqm,next to access bank head office oniru victoria island lagos,land,6000000000,0,0,0,High,28/01/2026,18/02/2026,2026-01,Lagos
4 Units Of 2 Bedroom Flat,eputu ibeju lekki lagos,Flat/Apartment,75000000,37500000,2,2,High,28/01/2026,18/02/2026,2026-01,Lagos
Exclusive Luxury 5 Bedroom Detached Duplex With Bq,megamound estate ikota lekki lagos,Detached,470000000,94000000,5,5,High,05/02/2026,18/02/2026,2026-02,Lagos
