title,location,property_type,price,price_per_bedroom,bedrooms,bathrooms,price_category,added_date,updated_date,month_added,state
For sale: Beautiful 5 Bedroom Maisonette With Inverter & Solar Panels,lekki phase 1 lagos,5 bedroom,500000000,100000000,5,5,High,15/10/2025,18/02/2026,2025-10,Lagos
For sale: Well Maintained 3 Bedroom Fully Furnished Apartment With Bq,ikoyi lagos,Flat/Apartment,750000000,250000000,3,3,High,09/10/2025,18/02/2026,2025-10,Lagos
For sale: Land Measuring 660 Sqm,lekki lagos,land,300000000,0,0,0,High,09/10/2025,18/02/2026,2025-10,Lagos
For sale: Land Measuring 1050 Sqm,lekki lagos,land,400000000,0,0,0,High,09/10/2025,18/02/2026,2025-10,Lagos
For sale: Plot Measuring 1246 Sqm,banana island ikoyi lagos,land,7000000000,0,0,0,High,09/10/2025,18/02/2026,2025-10,Lagos
For sale: Tastefully Finished 2 Bedroom Apartment With Bq,ikate elegushi lekki lagos,Flat/Apartment,190000000,95000000,2,2,High,21/10/2025,18/02/2026,2025-10,Lagos
For sale: Pay & Pack In Fully Serviced 4 Beds Terrace Duplex With A Maids Room,sangotedo ajah lagos,Terraced,120000000,30000000,4,4,High,22/10/2025,18/02/2026,2025-10,Lagos
For sale: Luxury Ajah Duplex,ajah lagos,duplex,200000000,50000000,4,4,High,22/10/2025,18/02/2026,2025-10,Lagos
For sale: 30 Prime Plots Of Land (648 Sqm Each),chevron drive lekki lagos,land,300000000,0,0,0,High,17/10/2025,18/02/2026,2025-10,Lagos
For sale: Tastefully Finished 5 Bedroom Detached Duplex With Elevator + Cinema + Swimming Pool,lekki phase 1 lagos,Detached,1500000000,300000000,5,5,High,21/10/2025,18/02/2026,2025-10,Lagos
"For sale: Magnificent 5 Beds With A Private Pool,gym & Cinema.",chevron drive lekki lagos,5 bedroom,650000000,130000000,5,5,High,31/01/2026,18/02/2026,2026-01,Lagos
For sale: Luxury 5 Bedroom Detached Duplex With Elevator + Cinema + Swimming Pool,royal garden estate ajiwe ajah lagos,Detached,750000000,150000000,5,5,High,05/11/2025,18/02/2026,2025-11,Lagos
For sale: 3 Bed & Bq Semi Detach Duplex With Swimming Pool (self Compound),abraham adesanya ajah lagos,Detached,120000000,40000000,3,3,High,11/11/2025,18/02/2026,2025-11,Lagos
For sale: Exquisite 4bedroom Duplex,orchid lekki lekki lagos,duplex,150000000,37500000,4,4,High,29/10/2025,18/02/2026,2025-10,Lagos
For sale: Affordable 5 Bedroom Detached Duplex With Swimming Pool,ministers hill maitama abuja phase 1,Detached,1900000000,380000000,5,5,High,14/11/2025,18/02/2026,2025-11,Abuja
For sale: Waterfront Land • Victoria Island,victoria island lagos,land,37500000000,0,0,0,High,20/11/2025,18/02/2026,2025-11,Lagos
For sale: Tastefully Finished 5 Bedroom Detached Duplex With Swimming Pool + Cinema,pinnock beach estate osapa london lekki lagos,Detached,850000000,170000000,5,5,High,20/11/2025,18/02/2026,2025-11,Lagos
For sale: Lekki Luxurious Duplex With Cinema & Swimming Pool*,2nd toll gate lekki lagos,duplex,400000000,80000000,5,5,High,21/11/2025,18/02/2026,2025-11,Lagos
For sale: Fully Serviced 2 & 4 Bedroom Terrace Duplex,orchid road lekki lagos,Terraced,120000000,60000000,2,2,High,20/11/2025,18/02/2026,2025-11,Lagos
For sale: Spacious 4bedroom Terrace Duplex,lekki phase 1 lagos,Terraced,600000000,150000000,4,4,High,16/02/2026,18/02/2026,2026-02,Lagos
For sale: Tastefully Finished 5 Bedroom Detached Duplex With Bq,ologolo lekki lagos,Detached,250000000,50000000,5,5,High,20/11/2025,18/02/2026,2025-11,Lagos
For sale: Cozy 3 Bedroom Semi Detached Duplex With A Bq,ikota lekki lagos,Detached,135000000,45000000,3,3,High,20/11/2025,18/02/2026,2025-11,Lagos
For sale: 4 Bedroom Semi Detached Duplex With A Bq For Sale????,ikota lekki lagos,Detached,220000000,55000000,4,4,High,20/11/2025,18/02/2026,2025-11,Lagos
"For sale: 4 Bed Semi Detached Duplex— Kado, Abuja",kado abuja phase 2,Detached,500000000,125000000,4,4,High,27/11/2025,18/02/2026,2025-11,Abuja
For sale: Land Measuring 1400sqm Lekki,lekki lagos,land,650000,0,0,0,Low,28/11/2025,18/02/2026,2025-11,Lagos
For sale: Spacious 4 Bedroom Duplex With A Pool,chevron drive lekki lagos,duplex,320000000,80000000,4,4,High,20/11/2025,18/02/2026,2025-11,Lagos
For sale: Massive 4 Bedroom Terrace Duplex With Bq,jahi abuja phase 2,Terraced,350000000,87500000,4,4,High,15/11/2025,18/02/2026,2025-11,Abuja
For sale: 17 Units Of 4 Bedroom Terrace Duplex With Bqs,nicon junction opposite maitama main katampe main abuja phase 2,Flat/Apartment,7000000000,700000000,10,10,High,23/11/2025,18/02/2026,2025-11,Abuja
"For sale: Spacious 5 Bedroom Duplex With A Bq, Pool",chevron axis lekki agungi lekki lagos,duplex,350000000,70000000,5,5,High,25/11/2025,18/02/2026,2025-11,Lagos
For sale: Massive 6 Bedroom Detached Duplex With Swimming Pool,efab metropolis estate karsana abuja phase 3,Detached,550000000,91666667,6,6,High,25/05/2025,18/02/2026,2025-05,Abuja
For sale: Tastefully Finished 2 Bedroom Apartment,osapa london lekki lagos,Flat/Apartment,150000000,75000000,2,2,High,18/01/2026,18/02/2026,2026-01,Lagos
For sale: Magnificent 5 Beds With A Private Pool,chevron toll gate lekki lekki lagos,5 bedroom,500000000,100000000,5,5,High,21/01/2026,18/02/2026,2026-01,Lagos
For sale: Tastefully Finished 5 Bedroom Detached Duplex With Swimming Pool + Cinema,lekki phase 1 lagos,Detached,1200000000,240000000,5,5,High,21/01/2026,18/02/2026,2026-01,Lagos
For sale: Tastefully Finished 6 Units Of 2 Bedroom Apartment,jahi abuja phase 2,Flat/Apartment,900000000,90000000,10,10,High,26/01/2026,18/02/2026,2026-01,Abuja
For sale: Tasfully Finished Apartment,aco gra lugbe lugbe abuja phase 4,Flat/Apartment,74099999,24700000,3,3,High,19/01/2026,18/02/2026,2026-01,Abuja
For sale: 450sqm Of Land,beachwood estate shapati ibeju lekki lagos,land,65000000,0,0,0,High,22/01/2026,18/02/2026,2026-01,Lagos
For sale: Spacious *4 Bedroom* Terrace Duplex With Bq,lekki phase 1 in a serene estate lekki lagos,Terraced,650000000,0,0,0,High,22/01/2026,18/02/2026,2026-01,Lagos
For sale: Manssionate 4 Bedroom,in a serene estate lekki phase 1 lagos,maisonette,480000000,0,0,0,High,22/01/2026,18/02/2026,2026-01,Lagos
For sale: Luxury 4 Bedroom Terrace Duplex With Bq In A Strategic Location,by coza church guzape abuja phase 1,Terraced,650000000,162500000,4,4,High,28/01/2026,18/02/2026,2026-01,Abuja
For sale: Luxury 4 Bedroom Terrace Duplex With Bq,jahi abuja phase 2,Terraced,320000000,80000000,4,4,High,28/01/2026,18/02/2026,2026-01,Abuja
For sale: Massive 6 Bedroom Detached Duplex With Elevator,asokoro main asokoro abuja phase 1,Detached,2500000000,416666667,6,6,High,31/01/2026,18/02/2026,2026-01,Abuja
For sale: Contemporary 3bedroom Terrace,ilaje ikota lekki lekki lagos,Terraced,120000000,40000000,3,3,High,31/01/2026,18/02/2026,2026-01,Lagos
For sale: Fenced And Gated Land,opebi ikeja lagos,land,600000000,0,0,0,High,01/02/2026,18/02/2026,2026-02,Lagos
For sale: Massive 4 Bedroom Terrace Duplex With Elevator Shaft,parkview estate ikoyi lagos,Terraced,1400000000,350000000,4,4,High,05/02/2026,18/02/2026,2026-02,Lagos
For sale: Massive 5 Bedroom Detached Duplex With Swimming Pool + Elevator,lekki phase 1 lagos,Detached,1300000000,260000000,5,5,High,03/02/2026,18/02/2026,2026-02,Lagos
For sale: Spacious Fully Service Exquisite 2bedroom Furnished Apartment,ikate lekki lekki lagos,Flat/Apartment,270000000,135000000,2,2,High,09/02/2026,18/02/2026,2026-02,Lagos
For sale: Affordable 5 Bedroom Detached Duplex With Bq,by market square kado abuja phase 2,Detached,700000000,140000000,5,5,High,18/01/2026,18/02/2026,2026-01,Abuja
For sale: Tastefully Finished 4 Bedroom Terrace Duplex With Swimming Pool,osapa london lekki lagos,Terraced,350000000,87500000,4,4,High,11/09/2025,18/02/2026,2025-09,Lagos
For sale: Luxury 5 Bedroom Terrace Duplex With Excellent Finishing,jahi abuja phase 2,Terraced,550000000,110000000,5,5,High,15/01/2026,18/02/2026,2026-01,Abuja
For sale: 2bedroom Flat With Governor Consent,"prime water estate, ikate lekki phase 1 lagos",Flat/Apartment,150000000,0,0,0,High,27/01/2026,18/02/2026,2026-01,Lagos
For sale: Magnificent 5 Beds With A Private Cinema & Pool,osapa london lekki lagos,5 bedroom,650000000,130000000,5,5,High,15/02/2026,18/02/2026,2026-02,Lagos
For sale: Tastefully Finished 5 Bedroom Detached Duplex With Elevator Shaft,apo resettlement apo abuja phase 2,Detached,580000000,116000000,5,5,High,09/02/2026,18/02/2026,2026-02,Abuja
For sale: Affordable 3 Bedroom Terrace Duplex With Bq,wuye abuja phase 2,Terraced,310000000,77500000,4,4,High,26/11/2025,18/02/2026,2025-11,Abuja
For sale: Tastefully Finished 4 Bedroom Semi Detached Duplex With Elevator,parkview estate ikoyi lagos,Detached,1200000000,300000000,4,4,High,28/06/2025,18/02/2026,2025-06,Lagos
For sale: Luxury 4 Bedroom Semi Detached Duplex In A Beautiful Estate,maiyegun beach estate jakande lekki phase 1 lagos,Detached,600000000,150000000,4,4,High,25/10/2025,18/02/2026,2025-10,Lagos
For sale: 20 Units Of Our 4 Bedroom Terraces,up to 6 12months instalment payment ajah lagos,Flat/Apartment,135000000,33750000,4,4,High,12/08/2025,18/02/2026,2025-08,Lagos
For sale: 3 Bedrooms Terrace Duplex+1 Bq For Sale.,lokogoma sunnyvale axis lokogoma abuja phase 2,Terraced,120000000,40000000,3,3,High,06/02/2026,17/02/2026,2026-02,Abuja
For sale: 4 Bedroom Flat In Banana Island,banana island ikoyi lagos,Flat/Apartment,1650000000,412500000,4,4,High,04/12/2025,18/02/2026,2025-12,Lagos
For sale: Unique 4bedroom Duplex And Bq,chevron lekki lagos,duplex,195000000,48750000,4,4,High,15/02/2026,18/02/2026,2026-02,Lagos
For sale: Newly Built 5 Bed Smart Duplex With Private Cinema,mojisola onikoyi estate lagos,duplex,2300000000,460000000,5,5,High,23/12/2025,17/02/2026,2025-12,Lagos
For sale: 1199.69 Sqm Cornerpiece Plot With Vacant Development,lekki phase 1 lagos,land,1600000000,0,0,0,High,26/09/2025,18/02/2026,2025-09,Lagos
For sale: 1230 Sqm Fully Vacant Residential 6 Units Of 3 Bed Flats,lekki lagos,Flat/Apartment,1300000000,0,0,0,High,26/09/2025,18/02/2026,2025-09,Lagos
For sale: For Sale | Gorgeously Built 4 Bedroom Semi Detached Duplex With Bq,orchid lekki lekki lagos,Detached,260000000,65000000,4,4,High,02/10/2025,18/02/2026,2025-10,Lagos
For sale: Tastefully Finished 3 Bedroom Apartment With Swimming Pool + Elevator,ikate elegushi lekki lagos,Flat/Apartment,310000000,103333333,3,3,High,03/10/2025,18/02/2026,2025-10,Lagos
For sale: 2 Plots Of Land Measuring 803.96 Sqm & 779.65 Sqm,ibeju lekki lagos,land,80000,0,0,0,Low,03/10/2025,18/02/2026,2025-10,Lagos
For sale: Spacious Luxury 3 Bedroom Penthouse Apartment With Car Park (4 Bays),eko atlantic victoria island lagos,Flat/Apartment,2700000000,900000000,3,3,High,08/10/2025,18/02/2026,2025-10,Lagos
"For sale: Waterfront Land Measuring 2,275 Sqm",banana island ikoyi lagos,land,3800000,0,0,0,Low,09/10/2025,18/02/2026,2025-10,Lagos
For sale: Affordable 5 Bedroom Detached Duplex Semi Finished,creek haven estate beside vgc victoria garden city lekki lagos,Detached,310000000,62000000,5,5,High,10/09/2025,18/02/2026,2025-09,Lagos
For sale: Tastefully Finished 5 Bedroom Detached Duplex With Swimming Pool,lekki county homes estate ( megamond) ikota lekki lagos,Detached,600000000,120000000,5,5,High,18/12/2025,18/02/2026,2025-12,Lagos
For sale: Federal Housing Authority,aco gra lugbe lugbe abuja phase 4,maisonette,73920000,24640000,3,3,High,08/01/2026,18/02/2026,2026-01,Abuja
For sale: Tastefully Finished 2 Bedroom Apartment With Swimming Pool,lekki phase 1 lagos,Flat/Apartment,330000000,165000000,2,2,High,10/12/2025,18/02/2026,2025-12,Lagos
For sale: Land Measuring 1007sqm Ikoyi,ikoyi lagos,land,3500000,0,0,0,Low,12/12/2025,18/02/2026,2025-12,Lagos
For sale: Luxurious 5 Beds Duplex With A Pool,lekki county lekki lagos,duplex,400000000,80000000,5,5,High,27/12/2025,18/02/2026,2025-12,Lagos
For sale: ?? For Sale | Luxury 5 Bedroom Fully Detached Duplex With Bq & Pool,lekki county homes lekki lagos,Detached,420000000,84000000,5,5,High,27/12/2025,18/02/2026,2025-12,Lagos
For sale: Elizabeth Court 3 Bedroom Apartment,mowe ofada mowe ogun area,Flat/Apartment,42500000,14166667,3,3,Mid,28/12/2025,18/02/2026,2025-12,Ogun
For sale: Landview Investment,ogun area,land,1000000,0,0,0,Low,05/01/2026,18/02/2026,2026-01,Ogun
For sale: 3 Bedroom Terrace Duplex For Sale????,before lagos business school ajah lagos,Terraced,80000000,26666667,3,3,High,09/01/2026,18/02/2026,2026-01,Lagos
For sale: Land Measuring 1100sqm Ikoyi,ikoyi lagos,land,2000000,0,0,0,Low,28/11/2025,18/02/2026,2025-11,Lagos
For sale: Jv Development Opportunity –lekki Phase 1,lekki phase 1 lagos,Flat/Apartment,1000000000,0,0,0,High,28/11/2025,18/02/2026,2025-11,Lagos
"For sale: Brand New, Luxury & Spacious 5 Bedroom Fully Detached Duplex With Bq And Swimming Pool Etc",prosper lekki phase 1 lagos,Detached,12000000000,0,0,0,High,22/01/2026,18/02/2026,2026-01,Lagos
For sale: Luxurious 4bedroom With Pool,ajah lagos,maisonette,260000000,65000000,4,4,High,15/01/2026,18/02/2026,2026-01,Lagos
For sale: Spacious Fully Serviced 4 Bedroom Terrace Duplex With A Bq For Sale,osapa london lekki lagos,Terraced,250000000,62500000,4,4,High,15/01/2026,18/02/2026,2026-01,Lagos
For sale: Tastefully Finished 4 Bedroom Terrace Duplex With Sports Centre,jahi abuja phase 2,Terraced,460000000,115000000,4,4,High,16/01/2026,18/02/2026,2026-01,Abuja
For sale: Ayhomes Luxury Bungalow,igando ibeju lekki lagos,Bungalow,80000000,20000000,4,4,High,20/01/2026,18/02/2026,2026-01,Lagos
For sale: Tastefully Finished 6 Bedroom Detached Duplex With Swimming Pool,efab metropolis karsana abuja phase 3,Detached,520000000,86666667,6,6,High,22/01/2025,18/02/2026,2025-01,Abuja
For sale: Massive 5 Bedroom Detached Duplex With 2 Rooms Chalet + 3 Rooms Bq,guzape abuja phase 1,Detached,2800000000,560000000,5,5,High,11/10/2025,18/02/2026,2025-10,Abuja
For sale: Tastefully Furnished 5 Bedroom Detached Duplex With Elevator + Cinema + Cinema,apo legislative quarters apo abuja phase 2,Detached,700000000,140000000,5,5,High,12/10/2025,18/02/2026,2025-10,Abuja
"For sale: | Luxury 5 Bedroom Fully Detached Duplex With Home Elevator, Cinema, Swimming Pool & Bq",osapa lekki lagos,Detached,830000000,166000000,5,5,High,24/10/2025,18/02/2026,2025-10,Lagos
For sale: Luxury 4bedroom Terrace Duplex,ikota lekki lagos,Terraced,95000000,23750000,4,4,High,24/10/2025,18/02/2026,2025-10,Lagos
For sale: Magnificent 5 Beds With A Private Pool,ikota lekki lagos,5 bedroom,330000000,66000000,5,5,High,24/10/2025,18/02/2026,2025-10,Lagos
For sale: Tastefully Finished 7 Bedroom Detached Duplex With Elevator + Cinema + Swimming Pool,off ty danjuma street asokoro abuja phase 1,Detached,4500000000,642857143,7,7,High,24/10/2025,18/02/2026,2025-10,Abuja
For sale: Contemporary 5 Bedroom Detached Duplex With Bq And Pool,ajah lagos,Detached,250000000,50000000,5,5,High,19/10/2025,18/02/2026,2025-10,Lagos
For sale: Affordable 3 Bedroom Apartment With Bq,lekki phase 1 lagos,Flat/Apartment,235000000,78333333,3,3,High,21/10/2025,18/02/2026,2025-10,Lagos
For sale: Luxury 5 Bedroom Detached Duplex With Swimming Pool + Cinema,osapa london lekki phase 1 lagos,Detached,1500000000,300000000,5,5,High,22/10/2025,18/02/2026,2025-10,Lagos
For sale: Tastefully Finished 4 Bedroom Apartment With Elevator + Swimming Pool,old ikoyi lagos,Flat/Apartment,950000000,237500000,4,4,High,25/10/2025,18/02/2026,2025-10,Lagos
For sale: Tastefully Finished 2 Bedroom Apartment With Elevator,ikate elegushi lekki lagos,Flat/Apartment,200000000,100000000,2,2,High,15/10/2025,18/02/2026,2025-10,Lagos
For sale: Lekki Phase 1 Tastefully 5bedroom Duplex,lekki phase 1 lagos,duplex,820000000,164000000,5,5,High,29/10/2025,18/02/2026,2025-10,Lagos
For sale: Tastefully Finished 3 Bedroom Apartment With Elevator + Swimming Pool,lekki phase 1 lagos,Flat/Apartment,300000000,100000000,3,3,High,05/02/2026,18/02/2026,2026-02,Lagos
For sale: Massive 6 Bedroom Detached Duplex With Bq,eleko junction eleko ibeju lekki lagos,Detached,350000000,70000000,5,5,High,17/09/2025,18/02/2026,2025-09,Lagos
For sale: Upscale 5 Bedroom Fully Detached Duplex With 2 Rooms Bq,lekki phase 1 lagos,Detached,800000000,160000000,5,5,High,29/09/2025,18/02/2026,2025-09,Lagos
For sale: Land Measuring 900 Sqm,lekki phase 1 lagos,land,950000000,0,0,0,High,29/09/2025,18/02/2026,2025-09,Lagos
For sale: Newly Built 2 Bedroom Apartment With Swimming Pool,ikate elegushi lekki lagos,Flat/Apartment,220000000,110000000,2,2,High,29/09/2025,18/02/2026,2025-09,Lagos
For sale: Massive 5 Bedroom Detached Duplex With Swimming Pool + Cinema,osapa lekki lagos,Detached,500000000,100000000,5,5,High,11/09/2025,18/02/2026,2025-09,Lagos
"For sale: Newly Built, Luxury 5 Bedroom Semi Detached House With Bq",ikoyi lagos,Detached,1200000000,240000000,5,5,High,01/10/2025,18/02/2026,2025-10,Lagos
For sale: Tastefully Finished 4 Bedroom Terrace Duplex,life camp abuja phase 3,Terraced,250000000,62500000,4,4,High,02/10/2025,18/02/2026,2025-10,Abuja
For sale: Tastefully Furnished 5 Bedroom Detached Duplex With Bq,life camp abuja phase 3,Detached,350000000,70000000,5,5,High,02/10/2025,18/02/2026,2025-10,Abuja
For sale: 4 Bedroom Terrace With Bq Abuja,guzape abuja phase 1,Terraced,350000000,87500000,4,4,High,19/11/2025,18/02/2026,2025-11,Abuja
For sale: Detached House,lekki phase 1 lagos,Detached,700000000,0,0,0,High,19/11/2025,18/02/2026,2025-11,Lagos
For sale: Tastefully Finished 5 Bedroom Detached Duplex In A Beautiful Estate,royal garden estate ajiwe ajah lagos,Detached,600000000,120000000,5,5,High,14/11/2025,18/02/2026,2025-11,Lagos
For sale: Tastefully Finished 5 Bedroom Detached Duplex With Swimming Pool,ocean breeze estate ologolo lekki lagos,Detached,500000000,100000000,5,5,High,14/11/2025,18/02/2026,2025-11,Lagos
For sale: Tastefully Finished 5 Bedroom Detached Duplex With Swimming Pool,idado lekki lagos,Detached,550000000,110000000,5,5,High,15/11/2025,18/02/2026,2025-11,Lagos
For sale: Tastefully Finished 5 Bedroom Detached Duplex,royal garden estate ajiwe ajah lagos,Detached,550000000,110000000,5,5,High,15/11/2025,18/02/2026,2025-11,Lagos
For sale: Outstanding Luxury 5 Bed Fully Detached Duplex,chevron lekki lagos,Detached,450000000,90000000,5,5,High,08/11/2025,18/02/2026,2025-11,Lagos
For sale: Massive 6 Bedroom Detached Duplex With Elevator (semi Finished,katampe ext. abuja phase 2,Detached,2000000000,333333333,6,6,High,24/01/2026,18/02/2026,2026-01,Abuja
For sale: Affordable 4 Bedroom Terrace Duplex With Bq,guzape abuja phase 1,Terraced,350000000,87500000,4,4,High,29/01/2026,18/02/2026,2026-01,Abuja
"For sale: Charming 5 Bedroom Detached Duplex With Swimming Pool, Rooftop Terrace & Bq",chevron tollgate lekki lagos,Detached,395000000,79000000,5,5,High,18/01/2026,18/02/2026,2026-01,Lagos
For sale: Tastefully Finished 4 Bedroom Maisonette With Elevator,banana island ikoyi lagos,maisonette,2200000000,550000000,4,4,High,14/02/2026,18/02/2026,2026-02,Lagos
For sale: Tastefully Finished 4 Bedroom Terrace Duplex With Bq,asokoro abuja phase 1,Terraced,600000000,150000000,4,4,High,19/11/2025,18/02/2026,2025-11,Abuja
For sale: Don’t Miss This Promo Own Acres Of Land At Airview Estate,ayetoro ibejulekki behind the international airport ibeju lekki lagos,land,25000000,0,0,0,Mid,10/10/2025,18/02/2026,2025-10,Lagos
For sale: Affordable 4 Bedroom Terrace Duplex,capital hub mabushi abuja phase 1,Terraced,300000000,75000000,4,4,High,10/11/2025,18/02/2026,2025-11,Abuja
For sale: Luxury 4 Bedroom Terrace Duplex,nike art gallary lekki phase 1 lagos,Terraced,350000000,87500000,4,4,High,10/02/2026,18/02/2026,2026-02,Lagos
For sale: Quintessential 5bedroom Luxurious Duplex And Pool,ologolo lekki lagos,duplex,420000000,84000000,5,5,High,16/02/2026,18/02/2026,2026-02,Lagos
For sale: Luxurious 5 Beds Detached Duplex With A Dedicated Inverter,osapa london lekki lagos,Detached,440000000,88000000,5,5,High,16/02/2026,18/02/2026,2026-02,Lagos
For sale: Affordable 4 Bedroom Terrace Duplex With Bq,ologolo lekki lagos,Terraced,175000000,43750000,4,4,High,16/06/2025,18/02/2026,2025-06,Lagos
For sale: Tastefully Finished 2 Bedroom Maisonette,lekki phase 1 lagos,maisonette,450000000,225000000,2,2,High,06/02/2026,18/02/2026,2026-02,Lagos
For sale: Brand New And Well Located 4 Bedroom Terrace Duplex With Bq,off freedom way lekki lagos,Terraced,385000000,96250000,4,4,High,20/01/2026,15/02/2026,2026-01,Lagos
For sale: Fcda C Of O,wuse zone 3 zone 1 7 abuja phase 1,land,150000000,75000000,2,2,High,09/01/2026,18/02/2026,2026-01,Abuja
For sale: Tastefully Finished 4 Bedroom Terrace Duplex In A Strategic Location,life camp abuja phase 3,Terraced,220000000,55000000,4,4,High,22/02/2024,18/02/2026,2024-02,Abuja
For sale: The Most Affordable Land At Landview City,"osele uku, asaba delta asaba delta",land,3000000,0,0,0,Low,31/12/2024,18/02/2026,2024-12,Delta
For sale: Affordable 4 Bedroom Detached Duplex With Bq,maitama abuja phase 1,Detached,1500000000,300000000,5,5,High,15/02/2026,18/02/2026,2026-02,Abuja
For sale: Tastefully Finished 5 Bedroom Detached Duplex With Cinema + Swimming Pool,vintage park estate ikate elegushi lekki lagos,Detached,1600000000,320000000,5,5,High,18/11/2024,18/02/2026,2024-11,Lagos
For sale: Primed 750sqm & 1300sqm & 2300sqm Residential Plot In A Strategic Location,mabuchi abuja phase 2,land,300000000,0,0,0,High,13/05/2024,18/02/2026,2024-05,Abuja
For sale: 2plots Of Land Fanced And Gated,pposite lagos business school along lekki epe express way lekki lagos,land,900000000,0,0,0,High,11/02/2026,18/02/2026,2026-02,Lagos
For sale: Tastefully Finished 4 Bedroom Terrace Duplex,ologolo lekki lagos,Terraced,150000000,37500000,4,4,High,07/01/2026,18/02/2026,2026-01,Lagos
For sale: Self Serviced 3 Bedroom Terrace Duplex With A Solar Inverter And Big Maids Room .,sangotedo ajah lagos,Terraced,110000000,36666667,3,3,High,26/01/2026,18/02/2026,2026-01,Lagos
For sale: 4 Bedroom Serviced Apartment With Pool Gym,old ikoyi lagos,Flat/Apartment,1950000000,487500000,4,4,High,26/10/2025,12/02/2026,2025-10,Lagos
For sale: 5 Bedrooms Duplex With Bq And Pool In Ajah,lekki palm city ajah lagos,duplex,280000000,56000000,5,5,High,17/02/2026,18/02/2026,2026-02,Lagos
For sale: Newly Built 5 Bed Detached Duplex With Rooftop Swimming Pool,ikoyi lagos,Detached,2100000000,420000000,5,5,High,24/12/2025,17/02/2026,2025-12,Lagos
For sale: Land In An Estate At Wawa,an estate warewa lagos extension ogun,land,60000000,0,0,0,High,13/02/2026,14/02/2026,2026-02,Lagos
For sale: **offplan 2 Bedroom Apartment For Sale With Cofo,victoria island lagos,Flat/Apartment,450000000,225000000,2,2,High,07/11/2025,18/02/2026,2025-11,Lagos
For sale: Affordable 5 Bedroom Detached Duplex With Swimming Pool,lekki county homes estate ( megamond) ikota lekki lagos,Detached,330000000,66000000,5,5,High,23/07/2025,18/02/2026,2025-07,Lagos
For sale: Tastefully Finished 2 Bedroom Apartment In A Strategic Location,whitesand school lekki phase 1 lagos,Flat/Apartment,250000000,125000000,2,2,High,18/06/2025,18/02/2026,2025-06,Lagos
For sale: Massive 8 Bedroom Detached Duplex With Elevator,asokoro abuja phase 1,Detached,2300000000,287500000,8,8,High,10/06/2025,18/02/2026,2025-06,Abuja
For sale: Tastefully Finished 5 Bedroom Detached Duplex With Bq,zeus paradise mabushi abuja phase 1,Detached,550000000,110000000,5,5,High,05/06/2025,18/02/2026,2025-06,Abuja
For sale: Tastefully Finished 4 Bedroom Terrace Duplex With Swimming Pool + Gym,ologolo lekki lagos,Terraced,220000000,55000000,4,4,High,30/05/2025,18/02/2026,2025-05,Lagos
For sale: Tastefully Finished 4 Bedroom Terrace Duplex With 2 Rooms Basement,diplomatic zone katampe ext. abuja phase 2,Terraced,350000000,87500000,4,4,High,12/06/2025,18/02/2026,2025-06,Abuja
For sale: Primed 600sqm & 1020sqm In A Beach Front Estate,maiyegun beach estate jakande lekki phase 1 lagos,land,500000000,0,0,0,High,14/10/2025,18/02/2026,2025-10,Lagos
For sale: Newly Built 4 Bed Duplex In A Gated Estate,osborne foreshore estate ikoyi lagos,duplex,720000000,180000000,4,4,High,26/12/2025,17/02/2026,2025-12,Lagos
For sale: Primed 600sqm & 800sqm & 1000sqm Residential Plots With Payment Plan,lekki phase 1 lagos,land,480000000,0,0,0,High,22/06/2025,18/02/2026,2025-06,Lagos
For sale: Direct Joint Venture – Lekki Phase 1,lekki phase 1 lagos,maisonette,1000000000,0,0,0,High,21/11/2025,18/02/2026,2025-11,Lagos
For sale: Spacious 5 Bedroom Detached Duplex With A Maids Room,osapa london lekki lagos,Detached,300000000,60000000,5,5,High,16/02/2026,18/02/2026,2026-02,Lagos
For sale: Affordable 3 Bedroom Flats & Duplexes,mobile road ajah ajah lagos,Flat/Apartment,85000000,28333333,3,3,High,31/01/2026,18/02/2026,2026-01,Lagos
"For sale: Magnificent 5 Beds With A Private Pool,gym & Cinema",osapa london lekki lagos,5 bedroom,800000000,160000000,5,5,High,16/02/2026,18/02/2026,2026-02,Lagos
For sale: Luxury 5 Bedroom Detached Duplex With Bq,banana island ikoyi lagos,Detached,7500000000,1500000000,5,5,High,01/10/2025,18/02/2026,2025-10,Lagos
For sale: The Most Affordable Commercial Land Beside Alaro City,skyview city epe lagos,Commercial land,40000000,0,0,0,Mid,19/09/2025,18/02/2026,2025-09,Lagos
For sale: Most Affordable Luxury Bungalow For The Elites Ayhomes Luxury Bungalow,don’t miss this at igando ibejulekki ibeju lekki lagos,Bungalow,80000000,20000000,4,4,High,19/09/2025,18/02/2026,2025-09,Lagos
"For sale: 3 Plots Measuring 3,583sqm, 3,719sqm & 3,583sqm",eko atlantic victoria island lagos,land,1700000,0,0,0,Low,29/09/2025,18/02/2026,2025-09,Lagos
"For sale: Land Measuring 800sqm, 900sqm & 1000sqm",osborne foreshore estate ikoyi lagos,land,2500000,0,0,0,Low,29/09/2025,18/02/2026,2025-09,Lagos
For sale: Tastefully Finished 4 Bedroom Apartment With Cinema + Lounge + Swimming Pool,old ikoyi lagos,Flat/Apartment,1900000000,475000000,4,4,High,29/09/2025,18/02/2026,2025-09,Lagos
For sale: Massive 4 Bedroom Terrace Duplex With Bq,diplomatic zone katampe ext. abuja phase 2,Terraced,370000000,92500000,4,4,High,31/01/2026,18/02/2026,2026-01,Abuja
